index,show_id,type,title,director,cast,country,date_added,release_year,rating,duration,listed_in,description
66,80188351,TV Show,Reply 1988,,"Lee Hye-ri, Park Bo-gum, Ryu Jun-yeol, Ko Kyoung-pyo, Lee Dong-hwi, Ryu Hye-young, Sung Dong-il, Lee Il-hwa",,"January 1, 2020",2015,TV-14,1 Season,"International TV Shows, Korean TV Shows, Romantic TV Shows",Take a nostalgic trip back to the late 1980s through the lives of five families and their five teenage kids living in a small neighborhood in Seoul.
67,81167101,TV Show,Save Me,,"Taecyeon, Seo Ye-ji, Cho Seong-ha, Woo Do‑hwan, Son Byung-ho, Kim Kwang-gyoo, Yun Yoo-sun, Park Ji-young, Jeong Hae-gyoon, Jang Hyeok-jin",,"January 1, 2020",2017,TV-14,1 Season,"International TV Shows, Korean TV Shows, TV Dramas",Four young men come to the rescue of a former classmate whose family has been sucked into the clutches of a religious cult and its charismatic leader.
68,81012487,TV Show,The Bride of Habaek,,"Shin Sae-kyeong, Nam Joo-hyuk, Lim Ju-hwan, Krystal Jung, Gong Myoung, Lee Gyoung-young, Yang Dong-geun",,"January 1, 2020",2017,TV-14,1 Season,"International TV Shows, Korean TV Shows, Romantic TV Shows","When a quest for divine stones in the human world goes awry, the water god Habaek seeks help from a psychiatrist predestined to serve him."
69,80214523,TV Show,Live,,"Jung Yu-mi, Lee Kwang-soo, Bae Seong-woo, Bae Jong-ok, Sung Dong-il",South Korea,"February 5, 2019",2018,TV-MA,1 Season,"Crime TV Shows, International TV Shows, Korean TV Shows",The police officers at South Korea's busiest patrol division toil day and night as keepers of law and peace – but the reality is far from orderly.
70,81045349,TV Show,Romance is a bonus book,,"Lee Jong-suk, Lee Na-young, Jung Eugene, Wi Ha-jun, Kim Tae-woo, Kim Yu-mi, Cho Han-cheul, Kim Sun-young",South Korea,"February 3, 2019",2019,TV-14,1 Season,"International TV Shows, Korean TV Shows, Romantic TV Shows",A gifted writer who's the youngest editor-in-chief ever at his publishing company gets enmeshed in the life of a former copywriter desperate for a job.
71,80155793,TV Show,The Sound of Your Heart,,"Kwang-soo Lee, Dae-Myung Kim, So-min Jung, Byeong-ok Kim, Mi-kyung Kim",South Korea,"February 24, 2017",2016,TV-14,1 Season,"International TV Shows, Korean TV Shows, TV Comedies","Based on Korea's longest-running webtoon series, this comedy follows the ridiculous daily lives of a cartoonist, his girlfriend and his subpar family."
72,80226338,TV Show,마녀사냥,,"Si-kyung Sung, Se-yoon Yoo, Dong-yup Shin, Ji-woong Heo, Sam Hammington",South Korea,"February 19, 2018",2015,TV-MA,1 Season,"International TV Shows, Korean TV Shows, Stand-Up Comedy & Talk Shows","Four Korean celebrity men and guest stars of both genders discuss women, sex and relationships – to an unprecedented degree of openness."
73,80154508,TV Show,Love for Ten: Generation of Youth,,"Sung-yeol Lee, Ji-hyun Nam, Clara Lee, Jin Won",South Korea,"February 17, 2017",2013,TV-14,1 Season,"International TV Shows, Korean TV Shows, Romantic TV Shows","A nerdy engineering student falls for a pretty, outgoing girl at his college. To get closer to her, he joins the theater group she belongs to."
74,80158801,TV Show,Nightmare High,,"So-hyun Kim, Min-hyuk Lee, Ki-joon Uhm, Da-Ye Kim, Seung-do Baek, Shin-ae Seo",South Korea,"February 15, 2017",2016,TV-14,1 Season,"International TV Shows, Korean TV Shows, TV Dramas","After a new teacher arrives, students' dreams begin to come true. Class president Ye-rim must solve the nightmarish mystery before it's too late."
75,80158803,TV Show,Spark,,"Jong-chan Na, Bo-ra Nam, Da-young Joo, Yeo One, Ki-sung Bae, Jin-joo Park, Eun-soo Kwon",South Korea,"February 15, 2017",2016,TV-14,1 Season,"International TV Shows, Korean TV Shows, Romantic TV Shows",A young woman's life gets a jump-start after she and a musical genius are both struck by the same falling star. But will the side effects derail love?
76,80150604,TV Show,White Nights,,"Yo-Won Lee, Goo Jin, U-ie, Hae-in Jung, Gook-hwan Jeon, Han-yong Jeong",South Korea,"February 14, 2017",2016,TV-14,1 Season,"International TV Shows, Korean TV Shows, TV Dramas","A coldhearted heiress, a man from her past and an ambitious new hire in her company all become entangled on a battleground for money and power."
77,81224811,TV Show,Pucca: Love Recipe,,"Jeonghwa Yang, Yongwoo Shin, Doug Erholtz, Melissa Fahn, Karen Strassman, Kirk Thornton, Spike Spencer",,"December 31, 2019",2018,TV-Y7,1 Season,"Kids' TV, Korean TV Shows","Faced with a threat to the survival of her family restaurant, as well as a rival for Garu's heart, Pucca fights for all that she loves."
78,80154689,TV Show,My Runway,,"Ji-yeon Park, Dong-ho Kang, Chul-woong Kang, Bo-hyun Ahn, Hak Jin, Se-jin Park, Kisum",South Korea,"December 30, 2016",2016,TV-14,1 Season,"International TV Shows, Korean TV Shows, Romantic TV Shows",An egotistic top male model and a pretty model wannabe are forced to live each other's lives until they figure out a way to undo their body switch.
79,80225526,TV Show,Part-Time Idol,,"Hee-jeong Kim, Seung-un Hwang, Soo-hyun Lee, Hyun-bin Kwon, Young-deuk Kwon, Kim Min-kyo",,"December 25, 2017",2017,TV-14,1 Season,"International TV Shows, Korean TV Shows, TV Comedies","After taking a break from the business, a music producer returns with a new project in mind: launching a co-ed pop idol group."
80,81004280,TV Show,Memories of the Alhambra,,"Hyun Bin, Park Shin-hye, Park Hoon, Kim Yong-rim, Chanyeol, Lee Re, Lee Hak Joo, Lee Si-won, Kim Eui-sung",South Korea,"December 2, 2018",2018,TV-14,1 Season,"Crime TV Shows, International TV Shows, Korean TV Shows","While looking for the cryptic creator of an innovative augmented-reality game, an investment firm executive meets a woman who runs a hostel in Spain."
81,80188605,TV Show,Cinderella and the Four Knights,,"Jung Il-woo, Ahn Jae-hyeon, Park So-dam, Lee Jung-shin, Kim Yong-geon, Choi Min, Son Na-eun",,"December 15, 2019",2016,TV-14,1 Season,"International TV Shows, Korean TV Shows, Romantic TV Shows","Catching the eye of a wealthy gentleman, spunky Ha-won gets hired to live with his three immature grandsons so she can whip them into shape."
82,81159258,TV Show,Crash Landing on You,,"Hyun Bin, Son Ye-jin, Seo Ji-hye, Kim Jung-hyun, Oh Man-seok, Kim Young-min, Kim Jung-nan, Kim Sun-young, Hwangwoo Seul-hye",,"December 15, 2019",2019,TV-14,1 Season,"International TV Shows, Korean TV Shows, Romantic TV Shows","A paragliding mishap drops a South Korean heiress in North Korea – and into the life of an army officer, who decides he will help her hide."
83,80214013,TV Show,Black,,"Seung-heon Song, A-ra Go, EL, Dong-jun Kim, Won-hae Kim, Seok-yong Jeong",South Korea,"December 15, 2017",2017,TV-MA,1 Season,"Crime TV Shows, International TV Shows, Korean TV Shows","A Grim Reaper, a detective and a woman who foresees death get ensnared in matters of life and death – and dark mysteries of twenty years past."
84,80126211,TV Show,Color of Woman,,"Jae Hee, Soo-kyung Lee, So-yi Yoon, Ji-ho Shim, Sang-Myeon Park, Joo-young Kim",South Korea,"December 15, 2016",2012,TV-14,1 Season,"International TV Shows, Korean TV Shows, Romantic TV Shows","Two women at a cosmetics company compete for love and success. One uses her brain and diligence, while the other works her beauty and charm."
85,80126185,TV Show,Goodbye My Wife,,"Soo-hyun Hong, Si Won Ryu, Ji-yoon Park, Min-soo Kim, Julien Kang, Joo-eun Oh, Seong-mo Jeong",South Korea,"December 15, 2016",2012,TV-14,1 Season,"International TV Shows, Korean TV Shows, Romantic TV Shows",A couple’s five-year marriage is put on the line when each of their first loves comes back hoping for another shot at romance.
86,80126212,TV Show,Happy And,,"Hee-Jin Lee, Hae-seong Kwon, Paul Stafford, Mi-ji Lee, Ik-tae Kim, Ki-hyeon Kim",,"December 15, 2016",2012,TV-14,1 Season,"International TV Shows, Korean TV Shows, TV Dramas",This relatable relationship drama explores the real-life trials and joys of married life through the lens of 11 different wives.
87,80126153,TV Show,Heaven's Garden,,"Bul-am Choi, Ho-Jeong Yoo, Sae-ron Kim, Chan-hee Kang, Woo-Sung Hyun, An Seo Hyun, Ho-Jin Kim",South Korea,"December 15, 2016",2011,TV-PG,1 Season,"International TV Shows, Korean TV Shows, TV Dramas","When her husband goes to jail for bankruptcy, a woman takes her two daughters to live with her father, who severed ties with her years ago."
88,80066800,TV Show,Immortal Classic,,"Jae-suk Han, Sun-Young Park, Du-shim Ko, Ye-jin Lim, Jong-hwan Choi, Ha-Nui Lee, Yun-Hoo Ko, Byeong-Ki Kim, Sun-kyung Kim, Yoon-Sik Baek",South Korea,"December 15, 2016",2012,TV-14,1 Season,"International TV Shows, Korean TV Shows, TV Dramas","Two renowned culinary families led by legendary food icons battle for the position of greatest chef, while protecting their secret kimchee recipes."
89,80031595,TV Show,K-POP Extreme Survival,,"Jung Eun Kim, Yu-hwan Park, Eun-ah Go, Yong Hwan Kwak, Jin Hyuk",South Korea,"December 15, 2016",2012,TV-14,1 Season,"International TV Shows, Korean TV Shows, Romantic TV Shows",Seung Yeon decides to chase her dream of becoming a K-pop star and audition for a popular group. There's only one catch: It's a boy band.
90,80126214,TV Show,Miss Panda & Mr. Hedgehog,,"Dong-hae Lee, Seung-ah Yoon, Jin-hyuk Choi, So-young Yoo, Yeo-jin Hong, Min-jin Jung",South Korea,"December 15, 2016",2012,TV-14,1 Season,"International TV Shows, Korean TV Shows, Romantic TV Shows","When a gifted patissier with a gloomy past meets a bright and easygoing café owner, he begins to shed his thorns and learns to love again."
91,81042804,TV Show,Hymn of Death,,"Lee Jong-suk, Shin Hye-sun, Kim Myeong-su, Park Seon-im, Kim Won-hae, Hwang Yeong-hee, Lee Ji-hoon, Go Bo-gyeol, Shin Jae-ha",South Korea,"December 14, 2018",2018,TV-14,1 Season,"International TV Shows, Korean TV Shows, Romantic TV Shows","During the Japanese colonial period, married playwright Kim U-jin falls in love with soprano Yun Sim-deok, one of Korea’s notable New Women."
92,81194523,TV Show,Suits,,"Jang Dong-gun, Park Hyung-sik, Jin Hee-kyung, Chae Jung-an, Ko Sung-hee, Choi Guy-hwa, Kim Young-ho, Lee Sang-yi",South Korea,"December 1, 2019",2018,TV-14,1 Season,"International TV Shows, Korean TV Shows, TV Dramas",A renowned corporate attorney at a prestigious firm gambles on a dropout with a photographic memory but no law degree to help on high-stakes cases.
93,81028939,TV Show,Haunted House,,"Jo Hyun-jung, Gim Young-eun, Gim Chae-ha, I So Eun, Choe Jae-ho",,"December 1, 2018",2017,TV-Y7-FV,1 Season,"Kids' TV, Korean TV Shows","With help from a 102-year-old goblin dwelling beneath their haunted apartment building, two siblings deal with ghosts and take on spooky mysteries."
94,80178427,TV Show,Bad Guys,,"Kim Sang-jung, Ma Dong-seok, Park Hae-Jin, Cho Dong-hyuk, Kang Ye-won, Kang Shin-il, Ji-a Min, Hwang Seung-eon",South Korea,"August 8, 2019",2014,TV-MA,1 Season,"Crime TV Shows, International TV Shows, Korean TV Shows","Reinstated to eradicate the worst crimes in the city, a detective requests the release of three convicts to enlist their help in catching the felons."
95,80183878,TV Show,Let's Eat 2,,"Yoon Du-jun, Seo Hyun-jin, Kwon Yul, Kim Hee-won, Hwang Seog-jeong, Cho Eun-ji, Hwang Seung-un, Lee Ju-seung, Kim Ji-young","Malaysia, Singapore, Hong Kong","August 8, 2019",2015,TV-14,1 Season,"International TV Shows, Korean TV Shows, Romantic TV Shows",Two classmates from elementary school reunite as next-door neighbors and discover their relationship was – and still is – defined by food.
96,80177986,TV Show,Let’s Eat,,"Lee Soo-kyung, Yoon Du-jun, Yoon So-hui, Shim Hyoung-tak, Do-yeon Lee, Jang Won-young, Jung Soo-young",South Korea,"August 8, 2019",2013,TV-14,1 Season,"International TV Shows, Korean TV Shows, Romantic TV Shows","With the help of her neighbors, a divorced woman residing in a one-person-household apartment complex learns to balance living alone and eating well."
97,80165295,TV Show,Misaeng,,"Im Si-wan, Kang So-ra, Lee Sung-min, Kang Ha-neul, Byun Yo-han, Kim Dae-myeong, Shin Eun-jung, Park Hae-joon",South Korea,"August 8, 2019",2014,TV-14,1 Season,"International TV Shows, Korean TV Shows, TV Dramas","Equipped with nothing more than a GED and strategies for the game of go, an office intern gets thrown into the cold reality of the corporate world."
98,80178404,TV Show,Oh My Ghost,,"Park Bo-young, Cho Jung-seok, Lim Ju-hwan, Kim Seul-ki",South Korea,"August 8, 2019",2015,TV-14,1 Season,"International TV Shows, Korean TV Shows, Romantic TV Shows","Possessed by the ghost of a lustful virgin, a timid assistant chef becomes confidently libidinous, drawing the attention of a haughty culinary star."
99,80165487,TV Show,Reply 1994,Shin Won-ho,"Go Ara, Jung Woo, Sung Dong-il, Dohee, Son Ho-jun, Kim Sung-kyun, Cha Seon-wu, Yoo Yeon-seok, Lee Il-hwa",South Korea,"August 8, 2019",2014,TV-14,1 Season,"International TV Shows, Korean TV Shows, Romantic TV Shows","All hailing from various parts of Korea, a group of college students go from being complete strangers to a big happy family at a Seoul boarding house."
100,70297144,TV Show,Reply 1997,Shin Won-ho,"Jung Eun-ji, Seo In-guk, Shin So-yul, Ji-won Eun, Lee Ho-won, Lee Si-eon, Sung Dong-il, Lee Il-hwa, Song Jong-ho",South Korea,"August 8, 2019",2012,TV-14,1 Season,"International TV Shows, Korean TV Shows, Romantic TV Shows","As a teen, Shi Won was obsessed with a boy band. Now 33 years old, Shi Won and her friends are reviving their memories as their school reunion nears."
101,80168068,TV Show,Love Alarm,,"Kim So-hyun, Jung Ga-ram, Song Kang, Ko Min-si, Z. Hera, Shin Seung-ho, Lee Jae-eung, Song Sun-mi",,"August 22, 2019",2019,TV-MA,1 Season,"International TV Shows, Korean TV Shows, Romantic TV Shows","In a world where an app alerts people if someone in the vicinity likes them, Kim Jojo experiences young love while coping with personal adversities."
102,81087764,TV Show,Possessed,,"Song Sae-byeok, Go Joon-hee, Youn Jung-hoon, Jo Han-sun, Lee Won-jong, Park Gene-woo, Kwon Hyuk-hyun, Park Sang-min",South Korea,"April 4, 2019",2019,TV-14,1 Season,"Crime TV Shows, International TV Shows, Korean TV Shows",A reluctant clairvoyant joins forces with a brusque police detective hiding a soft heart to help him solve criminal cases using her psychic abilities.
103,80162136,TV Show,Jumping Girl,,"Luna, U-kwon, Ha-na Jung, B-Bomb, Ha-seong Park",South Korea,"April 28, 2017",2015,TV-14,1 Season,"International TV Shows, Korean TV Shows, Romantic TV Shows","Sang-ah would do anything to shield pop star Ah-shin from rabid fans. But after an act of protection gone wrong, it looks like she's the crazy one."
104,80154638,TV Show,President,,"Su-jong Choi, Hee-Ra Ha, Jay Kim, Ji-hye Wang, Shin-il Kang",South Korea,"April 28, 2017",2010,TV-14,1 Season,"International TV Shows, Korean TV Shows, TV Dramas","An ambitious, talented politician embarks on an intense journey toward winning the presidency while juggling his complicated family affairs."
105,80162131,TV Show,What in the World Happened?,,"Eun-mi Go, Jaehyo, Eun-Hyung Jo, Ha-yeon Kim, Shin Yi, Kwang-sun Park",,"April 28, 2017",2015,TV-14,1 Season,"International TV Shows, Korean TV Shows, Romantic TV Shows",A happy secret romance between a 40-year-old woman and a 25-year-old man is complicated after a greeting card grants her wish to be young again.
106,81044884,TV Show,Persona,"Lee Kyoungmi, Yim Pilsung, Jeon Go-woon, Kim Jong-kwan","Lee Ji-eun (IU), Bae Doona, Park Hae Soo, Kim Tae-hun, Shim Dal-gi, Lee Sung-wook, Jung Jun Won",South Korea,"April 11, 2019",2019,TV-MA,1 Season,"International TV Shows, Korean TV Shows, TV Dramas",An exploration of different personas in an eclectic collection of four works by critically acclaimed Korean directors.
107,80170688,TV Show,The Miracle,,"Donghyun Kim, Nahyun, Yang Hak Jin, Yoon Hwa Hong",South Korea,"April 10, 2017",2016,TV-14,1 Season,"International TV Shows, Korean TV Shows, TV Dramas","Polar opposites in personality and looks, fraternal twin sisters who live completely different lives wake up one day to find they've switched bodies."
108,70296735,TV Show,"That Winter, the Wind Blows",,"Zo In-sung, Song Hye-kyo, Kim Bum, Jung Eun-ji, Bae Jong-ok, Young-hoon Kim",South Korea,"April 1, 2019",2013,TV-14,1 Season,"International TV Shows, Korean TV Shows, Romantic TV Shows","Seeing the chance to enrich himself by deceiving a blind heiress, clever con man Oh Soo just does what comes naturally – but his plans soon change."
109,81072571,TV Show,Tobot,,"Octavian Kaul, Valin Shinyei, Chelsea Miller, Sunni Westbrook, Sam Vincent, Rebecca Shoichet, Jeff Evans Todd, Paul Dobson, Rhona Rees",Canada," September 11, 2019",2018,TV-Y7-FV,2 Seasons,"Kids' TV, Korean TV Shows",They’re robots that can transform into cars – and the Tobots are committed to fighting villains to protect the city and root out crime.
110,80059047,TV Show,Robocar Poli,,"Donald Reignoux, Alexis Tomassian, Thomas Sagols, Pierre Francois Pistori, Bruno Magne, Catherine Desplaces, Fily Keita, Adeline Chetail, Bertrand Liebert, Christophe Lemoine",South Korea," September 1, 2017",2015,TV-Y,4 Seasons,"Kids' TV, Korean TV Shows","When disaster strikes in Brooms Town, police car Robocar Poli, fire truck Robotruck Roy and their friends on the rescue team race to save the day."
111,80212481,TV Show,YooHoo to the Rescue,,"Kira Buckland, Ryan Bartley, Bryce Papenbrook, Cassandra Morris, Lucien Dodge, Kyle Hebert",South Korea," October 11, 2019",2019,TV-Y,2 Seasons,"Kids' TV, Korean TV Shows","In a series of magical missions, quick-witted YooHoo and his can-do crew travel the globe to help animals in need."
112,80209553,TV Show,Busted!,,"Yoo Jae-suk, Ahn Jae-wook, Kim Jong-min, Lee Kwang-soo, Park Min-young, Sehun, Kim Se-jeong",South Korea," November 8, 2019",2019,TV-14,2 Seasons,"International TV Shows, Korean TV Shows, Stand-Up Comedy & Talk Shows","Tackling different mysteries in each episode of this game show, seven sleuths get closer to solving the biggest one of all: What happened to Project D?"
113,81070963,TV Show,Chief of Staff,,"Lee Jung-jae, Shin Mina, Lee Elijah, Kim Dong-jun, Jung Jin-young, Kim Kap-soo, Jung Woong-in, Im Won-hee, Kim Hong-pa",South Korea," November 12, 2019",2019,TV-14,2 Seasons,"International TV Shows, Korean TV Shows, TV Dramas","As a chief of staff in the National Assembly, Jang Tae-jun influences power behind the scenes while pursuing his own ambitions to rise to the top."
114,80195839,TV Show,Hyori's Bed & Breakfast,,"Hyo-ri Lee, Sang-soon Lee, Ji-eun Lee",," March 29, 2018",2018,TV-PG,2 Seasons,"International TV Shows, Korean TV Shows, Reality TV","K-pop diva Lee Hyo-ri and her husband open up their home on the beautiful Jeju Island to welcome travelers for free stays, meals and late-night chats."
115,80991329,TV Show,Larva Island,,"Hong Bum-ki, Eddy Lee, Ahn Hyo-min, Kang Shi-hyun, Tom Wayland, Erica Schroeder",," March 1, 2019",2019,TV-Y7,2 Seasons,"Kids' TV, Korean TV Shows, TV Comedies","Stranded on a tropical island, two silly larva buddies find slapstick fun in everything from discovering food to meeting new animal friends."
116,81026700,TV Show,My First First Love,,"Ji Soo, Jung Chae-yeon, Jinyoung, Choi Ri, Kang Tae-oh, Hong Ji-yoon",South Korea," July 26, 2019",2019,TV-PG,2 Seasons,"International TV Shows, Korean TV Shows, Romantic TV Shows","Due to various personal reasons, a group of Yun Tae-o’s friends move into his house, where they experience love, friendship, and everything in between."
117,80142000,TV Show,Tayo the Little Bus,,"Robyn Slade, Kami Desilets",South Korea," July 1, 2019",2014,TV-Y,2 Seasons,"Kids' TV, Korean TV Shows","As they learn their routes around the busy city, Tayo and his little bus friends discover new sights and go on exciting adventures every day."
118,81100135,TV Show,Zombie Dumb,,,," July 1, 2019",2018,TV-Y7,2 Seasons,"Kids' TV, Korean TV Shows, TV Comedies","While living alone in a spooky town, a young girl befriends a motley crew of zombie children with diverse personalities."
119,80008583,TV Show,Larva,,,Russia," February 1, 2016",2015,TV-G,3 Seasons,"Kids' TV, Korean TV Shows, TV Comedies",Two curious worms spend their days investigating the otherworldly objects that fall through the grate into their subterranean world.
120,81224868,TV Show,Robot Trains,,"Bill Rogers, Carrie Savage, Ken Spassione, Angela Mulligan, Mark Szabo, Daniel J. Edwards, Mike Pollock, Anthony Salerno",South Korea," December 31, 2019",2018,TV-Y7,2 Seasons,"Kids' TV, Korean TV Shows","Keeping peace and safety in Train World is no easy task, but for five trains with the power to transform into robots, every crisis is an adventure!"
121,81029884,TV Show,The Sound of Your Heart: Reboot,,"Sung Hoon, Kwon Yuri, Tae Hang-ho, Joo Jin-mo, Shim Hye-jin, Ji Su-won, Park Cheol-min, Kim Seong-won, Kang Yoon, Seo Eun-ah, Bae Yoon-kyung",South Korea," December 3, 2018",2018,TV-14,2 Seasons,"International TV Shows, Korean TV Shows, TV Comedies","Webtoonist Cho Seok is back with more anecdotes of mix-ups, unintended antics, and bathroom blunders in this reboot starring an all-new cast."
122,80128686,TV Show,"Hello, My Twenties!",,"Ye-ri Han, Seung-Yeon Han, Eun-bin Park, Hwa-young Ryu, Hye-soo Park",South Korea," December 18, 2017",2017,TV-14,2 Seasons,"International TV Shows, Korean TV Shows, Romantic TV Shows","With different personalities, life goals and taste in men, five female college students become housemates in a shared residence called Belle Epoque."
123,81215567,TV Show,Cocomong,,"Jung Sun-hye, Yang Jeong-hwa, Kim Jang, Ryoo Jeom-hee, Hong Bum-ki, Shin Yong-woo",," December 15, 2019",2015,TV-Y,2 Seasons,"Kids' TV, Korean TV Shows","What's in your fridge? In sunny Refrigerator Land, everyday ingredients transform into animal friends who love a good adventure."
124,81210234,TV Show,Space Jungle,,"Kim Min-hee, Park Yoon-hee, Sun Sung-wook",," December 1, 2019",2016,TV-Y7,2 Seasons,"Kids' TV, Korean TV Shows, TV Comedies","A broken spaceship strands four very tiny aliens on Earth, where they discover an adventure (and strange dangers!) that they never expected."
125,80196221,TV Show,Super Wings,,"Luca Padovan, Evan Smolin, Junah Jang, Colin Critchley","United States, South Korea, China"," December 1, 2017",2017,TV-Y,2 Seasons,"Kids' TV, Korean TV Shows",A cheerful jet and his transforming pals strive to find peaceful solutions to their problems while delivering packages to children around the globe.
126,80176929,TV Show,Abnormal Summit,"Jung-ah Im, Seung-uk Jo","Hyun-moo Jun, Si-kyung Sung, Se-yoon Yoo",South Korea," August 4, 2017",2017,TV-PG,2 Seasons,"International TV Shows, Korean TV Shows, Stand-Up Comedy & Talk Shows","Led by a trio of Korean celebs, a multinational panel of men engage in – usually – lighthearted debates on issues that surround Korea and beyond."
127,80176931,TV Show,Chef & My Fridge,,"Seong-joo Kim​, Jung-hwan Ahn",South Korea," August 4, 2017",2017,TV-PG,2 Seasons,"International TV Shows, Korean TV Shows, Reality TV",The best chefs of Korea go head-to-head to create impromptu dishes that feature ingredients found inside the guest stars' very own refrigerators.
128,80175275,TV Show,Vroomiz,,"Joon-seok Song, Jeong-hwa Yang, Sang-hyun Um, So-yeong Lee, Jeong-shin Woo, So-yeong Hong, Tae-yeol Jeon",South Korea," August 1, 2017",2016,TV-Y,3 Seasons,"Kids' TV, Korean TV Shows","For these half-car, half-animal friends, each day in Zippy City is a chance to have fun, be creative and use teamwork to solve difficult problems."
129,80176842,TV Show,Men on a Mission,Jung-ah Im,"Ho-dong Kang, Soo-geun Lee, Sang-min Lee, Young-chul Kim, Jang-hoon Seo, Hee-chul Kim, Kyung-hoon Min",South Korea," April 9, 2019",2019,TV-14,4 Seasons,"International TV Shows, Korean TV Shows, Stand-Up Comedy & Talk Shows","Male celebs play make-believe as high schoolers, welcoming star transfer students every week and engaging in battles of witty humor and slapstick."
130,80116626,TV Show,The Cravings,,"Park Hee-bon, Phillip Choi, Hong Wan-pyo, Choi Bae-yeong, Hyuk-kwon Park, Yang Hyeon-min",South Korea," April 20, 2017",2016,TV-14,2 Seasons,"International TV Shows, Korean TV Shows, TV Comedies","Thirtysomething career woman Jae-yeong attempts to juggle her job and personal relationships, all the while never failing to eat well."
131,80036747,TV Show,Pororo - The Little Penguin,,,South Korea," April 19, 2019",2013,TV-Y,2 Seasons,"Kids' TV, Korean TV Shows","On a tiny island, Pororo the penguin has fun adventures with his friends Eddy the fox, Loopy the beaver, Poby the polar bear and Crong the dinosaur."
