index,show_id,type,title,director,cast,country,date_added,release_year,rating,duration,listed_in,description
0,81095101,TV Show,Vagabond,,"Lee Seung-gi, Bae Suzy, Shin Sung-rok, Moon Jung-hee, Baek Yoon-sik, Moon Sung-keun, Lee Gyoung-young, Lee Ki-young, Kim Min-jong, Jung Man-sik, Hwang Bo-ra",South Korea,"September 21, 2019",2019,TV-MA,1 Season,"International TV Shows, Korean TV Shows, TV Action & Adventure","When his nephew dies in a plane crash, stunt man Cha Dal-geon resolves to find out what happened, with the help of covert operative Go Hae-ri."
1,81144925,TV Show,When the Camellia Blooms,,"Kong Hyo-jin, Kang Ha-neul, Kim Ji-seok, Oh Jung-se, Yeom Hye-ran, Son Dam-bi, Ji E-su, Go Du-sim",South Korea,"September 18, 2019",2019,TV-14,1 Season,"International TV Shows, Korean TV Shows, Romantic TV Shows","Dongbaek is a single mother. When a potential new love enters her life, she finds ways to defy the social stigmas surrounding her."
2,81011508,TV Show,Life,,"Lee Dong-wook, Cho Seung-woo, Won Jin-ah, Lee Kyu-hyung, Moon Sung-keun, Yoo Jae-myung, Moon So-ri, Chun Ho-jin",South Korea,"September 12, 2018",2018,TV-MA,1 Season,"International TV Shows, Korean TV Shows, TV Dramas","At Korea's top university medical center, ideals and interests collide between a patient-centered ER doctor and the hospital's newly-appointed CEO."
3,81161487,TV Show,My Country: The New Age,,"Yang Se-Jong, Woo Do‑hwan, Seolhyun, Jang Hyuk, Kim Young-chul, In Gyo-jin, Yu Oh-seong, Ahn Nae-sang",South Korea,"October 5, 2019",2019,TV-14,1 Season,"International TV Shows, Korean TV Shows, TV Action & Adventure","At the end of the Goryeo period, there were those who led the charge to proclaim a new age – and the ordinary individuals who risked everything."
4,80220650,TV Show,YG Future Strategy Office,,"Seungri, Yoo Byung Jae, Lee Jai-jin, Jinu, Son Se-bin, Kim Ga-eun, Park Choong-hwan, Baek Yeong-gwang, Choi Sin-deuk",South Korea,"October 5, 2018",2018,TV-MA,1 Season,"International TV Shows, Korean TV Shows, TV Comedies","K-pop star Seungri, BIGBANG's youngest member, tries to lead a team of bumbling staff at YG's Future Strategy Office in this mockumentary sitcom."
5,81166978,TV Show,"Bring It On, Ghost",Park Joon-hwa,"Taecyeon, Kim So-hyun, Kwon Yul, Kim Sang-ho, Kang Ki-young, Lee Da-wit, Kim Min-sang, Yun Seo-hyun",South Korea,"October 30, 2019",2016,TV-14,1 Season,"International TV Shows, Korean TV Shows, Romantic TV Shows",A college student with psychic abilities takes in an amnesiac ghost as his roommate – who ends up helping him hunt down spooky spirits.
6,81167029,TV Show,Tomorrow with You,,"Shin Mina, Lee Je-hoon, Kim Ye-won, Cho Han-cheul, Baek Hyeon-jin, Kang Ki-doong, Park Joo-hee, Oh Gwang-rok",South Korea,"October 30, 2019",2017,TV-14,1 Season,"International TV Shows, Korean TV Shows, Romantic TV Shows",The head of a real estate firm with the ability to travel through time by taking the subway marries a photographer to try and change his future.
7,81193245,TV Show,MONKART,,"Kim Jae-ha, Kwon Ji-hye, Lee Bo-hee, Um Sang-hyun, Jung Yoon-jung, Kim Bo-min, Hong So-young, Hong Bum-ki, Ahn Jang-hyuk",,"October 18, 2019",2017,TV-Y7,1 Season,"Kids' TV, Korean TV Shows",Jin and his dragon monster Draka set out on a racing adventure and try to save the kingdom from evil forces.
8,81077044,TV Show,Another Miss Oh,,"Seo Hyun-jin, Eric Moon, Jeon Hye-bin, Ye Ji-won, Kim Ji-seok, Lee Jae-yoon, Lee Han-wi, Kim Mee-kyeong, Oh Man-seok, Lee Pil-mo",South Korea,"October 16, 2019",2016,TV-14,1 Season,"International TV Shows, Korean TV Shows, Romantic TV Shows","A sound director who suddenly starts getting visions of someone else’s future gets mired in the lives of two women, who happen to share the same name."
9,81167011,TV Show,Second 20s,,"Choi Ji-woo, Lee Sang-yun, Choi Won-young, Kim Min-jae, Son Na-eun, Jung Soo-young, Choi Yoon-so, Park Hyo-ju",South Korea,"October 16, 2019",2015,TV-14,1 Season,"International TV Shows, Korean TV Shows, Romantic TV Shows","Facing major changes, a mother realizes it's time to live for herself and decides to enroll in college, where she finds her dream as well as new love."
10,81191500,TV Show,The Lies Within,,"Lee Min-ki, Lee Yoo-young, On Ju-wan, Lee Jun-hyeok, Yun Jong-seok, Kim Jong-soo, Seo Hyun-woo, Song Young-chang, Lee Jun-hyuk",South Korea,"October 13, 2019",2019,TV-14,1 Season,"Crime TV Shows, International TV Shows, Korean TV Shows","After her father dies and her husband goes missing, Kim Seo-hui teams up with detective Jo Tae-sik and joins the National Assembly."
11,81166946,TV Show,Cheese in the Trap,Lee Yoon-jung,"Park Hae-Jin, Kim Go-eun, Seo Kang-jun, Lee Sung-kyoung, Nam Joo-hyuk, Park Min-ji, Hwang Seog-jeong, Son Byung-ho, Ahn Kil-kang",South Korea,"October 1, 2019",2016,TV-14,1 Season,"International TV Shows, Korean TV Shows, Romantic TV Shows","In this adaptation of a popular webtoon, a poor student trying to navigate college life gains the attention of a wealthy upperclassman with a dark side."
12,81167065,TV Show,Chicago Typewriter,,"Yoo Ah-in, Im Soo-jung, Ko Kyoung-pyo, Kwak Si-yang, Jo Woo-jin, Yang Jin-sung, Jeon Soo-kyeong, Ji Dae-han, Chun Ho-jin",South Korea,"October 1, 2019",2017,TV-14,1 Season,"International TV Shows, Korean TV Shows, Romantic TV Shows",A veterinarian and two writers have a mysterious connection to Korean independence fighters from the Japanese colonial period.
13,81036448,TV Show,Miniforce X,,,South Korea,"October 1, 2019",2018,TV-Y7-FV,1 Season,"Kids' TV, Korean TV Shows",Zenos wants to use the Earth’s negative energy for his own good – and it's up to Miniforce X to stop this space alien’s evil plans.
14,80987077,TV Show,Signal,,"Kim Hye-su, Lee Je-hoon, Cho Jin-woong, Jang Hyun-sung, Jeong Hae-gyoon, Kim Won-hae, Jung Han-bi, Lee Yu-jun, Son Hyeon-ju",South Korea,"October 1, 2019",2016,TV-14,1 Season,"Crime TV Shows, International TV Shows, Korean TV Shows","Communicating via a walkie-talkie that transcends time, a profiler from 2015 and a detective from 1989 join forces to tackle crimes and injustice."
15,80188730,TV Show,The K2,,"Ji Chang-wook, Song Yoon-a, Lim Yoona, Cho Seong-ha, Kim Kap-soo, Lee Jung-jin, Son Tae-young, Shin Dong-mi",South Korea,"October 1, 2019",2016,TV-14,1 Season,"International TV Shows, Korean TV Shows, Romantic TV Shows",A fugitive soldier gets swept up in personal and political intrigue when he's hired as a bodyguard for the family of a presidential candidate.
16,81167083,TV Show,The Liar and His Lover,,"Lee Hyun-woo, Joy, Lee Jung-jin, Lee Seo-won, Hong Seo-young, Choi Min-soo, Lim Ye-jin, Jang Ki-yong, Song Kang, Park Ji-young",South Korea,"October 1, 2019",2017,TV-PG,1 Season,"International TV Shows, Korean TV Shows, Romantic TV Shows",A talented singer falls in love at first sight with a music prodigy who has an affinity for lies – and a knack for being a hit-making producer.
17,81167047,TV Show,Tunnel,,"Choi Jin-hyuk, Yoon Hyun-min, Lee Yoo-young, Cho Hee-bong, Kim Byoung-cheol, Kang Ki-young, Kim Min-sang, Mun Suk, Lee Yong-nyeo",South Korea,"October 1, 2019",2017,TV-MA,1 Season,"Crime TV Shows, International TV Shows, Korean TV Shows","While chasing a serial murderer, a detective ends up 30 years in the future, where he tries to solve the case alongside new partners."
18,81193313,TV Show,Chocolate,,"Ha Ji-won, Yoon Kye-sang, Jang Seung-jo, Kang Bu-ja, Lee Jae-ryong, Min Jin-woong, Kim Won-hae, Yoo Teo",South Korea,"November 30, 2019",2019,TV-14,1 Season,"International TV Shows, Korean TV Shows, Romantic TV Shows","Brought together by meaningful meals in the past and present, a doctor and a chef are reacquainted when they begin working at a hospice ward."
19,80198001,TV Show,Strong Girl Bong-soon,,"Park Bo-young, Park Hyung-sik, Ji Soo, Shim Hye-jin, Yu Jae-myeong, Jeon Seok-ho, Im Won-hee, Kim Won-hae",South Korea,"November 24, 2019",2017,TV-14,1 Season,"Crime TV Shows, International TV Shows, Korean TV Shows","Born with supernatural strength, Bong-soon fights evil and procures justice while getting tangled in a love triangle with her CEO boss and cop crush."
20,80214115,TV Show,Argon,,"Woo-hee Chun, Joo-hyuk Kim, Won-sang Park",South Korea,"November 22, 2017",2017,TV-MA,1 Season,"International TV Shows, Korean TV Shows, TV Dramas","In a world filled with provocative (and often misleading) news, a passionate team of investigative TV reporters strives to bring truths to light."
21,81033650,TV Show,Inheritors,,"Lee Min-ho, Park Shin-hye, Kim Woo-bin, Krystal Jung, Kim Ji-won, Choi Jin-hyuk, Kang Ha-neul, Kim Sung-ryoung, Kim Mee-kyeong, Yoon Jin-seo",South Korea,"November 15, 2019",2013,TV-14,1 Season,"International TV Shows, Korean TV Shows, Romantic TV Shows","After a chance encounter in LA, two teens from different social backgrounds reunite at an exclusive high school attended by Korea’s über rich."
22,81033645,TV Show,My Sassy Girl,,"Joo Won, Oh Yeon-seo, Lee Jung-shin, Kim Yoon-hye, Sohn Chang-min, Yoon Se-a, Cho Hee-bong, Jung Woong-in, Lee Kyung-hwa",South Korea,"November 15, 2019",2017,TV-14,1 Season,"International TV Shows, Korean TV Shows, Romantic TV Shows",A refined young Joseon scholar's life turns upside down after he rescues a drunk princess who later accuses him of taking something precious from her.
23,80187302,TV Show,Stranger,,"Seung-woo Cho, Doona Bae, Joon-hyuk Lee, Kyeong-yeong Lee, Jae-myung Yoo, Hye-sun Shin",South Korea,"November 1, 2017",2017,TV-MA,1 Season,"Crime TV Shows, International TV Shows, Korean TV Shows","With the help of a gutsy female detective, a prosecutor who has lost the ability to feel empathy tackles a murder case amid political corruption."
24,81087762,TV Show,Abyss,,"Park Bo-young, Ahn Hyo-seop, Lee Sung-jae, Lee Si-eon, Han So-hee, Kwon Soo-hyun, Kim Sa-rang, Ahn Se-ha, Yun Yoo-sun",South Korea,"May 7, 2019",2019,TV-14,1 Season,"Crime TV Shows, International TV Shows, Korean TV Shows","After meeting an untimely demise in separate incidents, Cha Min and Go Se-yeon discover they’ve come back to life in new bodies they don’t recognize."
25,80990935,TV Show,Something in the Rain,,"Son Ye-jin, Jung Hae-in, Jang So-yeon",South Korea,"May 26, 2018",2018,TV-MA,1 Season,"International TV Shows, Korean TV Shows, Romantic TV Shows","Reunited with her best friend’s younger brother, who’s back from a stint abroad, a recently dumped career woman begins to see him in a new light."
26,80098046,TV Show,12 Years Promise,,"So-yeon Lee, Namkoong Min, Tae-im Lee, So-hui Yoon, Won-keun Lee, Hyo-young Ryu",South Korea,"May 22, 2017",2014,TV-14,1 Season,"International TV Shows, Korean TV Shows, Romantic TV Shows","A pregnant teen is forced by her family to leave her boyfriend and assume a new identity in America, but 12 years later, the couple reunites in Korea."
27,80091779,TV Show,Beating Again,,"Kyung-ho Jung, So-yeon Kim, Hyun-min Yoon, Goo Jin, Hyun-joo Gong, Si-eon Lee, Yeong-gyu Park, Seok-Hwan An, Myung-Ryul Nam, Eun-ji Jo",South Korea,"May 22, 2017",2015,TV-14,1 Season,"International TV Shows, Korean TV Shows, Romantic TV Shows","After enduring both business and family upheavals, a ruthless investment director has a heart transplant and finds a new way to look at life and love."
28,80091783,TV Show,Can We Get Married?,,"Sung Jun, So-min Jung, Sung-min Kim, Ae-yeon Jeong, Mi-sook Lee, Eun-sook Sunwoo, Seok-woo Kang, Young-kwang Kim, Han Groo, Jin-soo Kim",South Korea,"May 22, 2017",2012,TV-14,1 Season,"International TV Shows, Korean TV Shows, Romantic TV Shows","On the cusp of marriage or divorce, four couples consider the meaning of love, sharing a life, meddling families and the weight of their commitment."
29,80098047,TV Show,Last,,"Kye-sang Yoon, Beom-su Lee, Ye-ji Seo, Won-sang Park, Ye-jin Park, Hyung-jin Gong, Jong-jun Jeong, Se-ha Ahn, Jae-yee Goo, Yong-woo Lee",South Korea,"May 22, 2017",2015,TV-14,1 Season,"Crime TV Shows, International TV Shows, Korean TV Shows","When his big stock plan fails, a hotshot fund manager winds up homeless and must learn the secret ranking system of the street in order to survive."
30,80091781,TV Show,Secret Affair,,"Hee-ae Kim, Ah-in Yoo, Hye-jin Shim, Hyuk-kwon Park, Hye-eun Kim, Soo-jin Kyung, Yong-gun Kim, Chang-wan Kim, Tae-hwan Choi, Kan-hie Lee",South Korea,"May 22, 2017",2014,TV-14,1 Season,"International TV Shows, Korean TV Shows, Romantic TV Shows","A married middle-aged woman is swept off her feet, both romantically and artistically, by a gifted young pianist."
31,80091778,TV Show,This Is My Love,,"Jin-mo Joo, Sa-rang Kim, Junior, Ja-in Lee, Sung-hyun Baek, So-hui Yoon",South Korea,"May 22, 2017",2015,TV-14,1 Season,"International TV Shows, Korean TV Shows, Romantic TV Shows","A renowned actor who is still pining over the loss of his first real love writes an autobiography about his memories of her, hoping to reconnect."
32,80176819,TV Show,Hidden Singer,,"Hyun-moo Jun, Solbi, Dong-hyuk Jang, Young-hoon Joo",South Korea,"May 19, 2017",2015,TV-Y7,1 Season,"International TV Shows, Korean TV Shows, Reality TV",Pop stars and impersonators face off to be the last one standing as the audience tries to determine the real singer by listening to their voices only.
33,70213130,TV Show,Boys Over Flowers,,"Hye-sun Ku, Min-ho Lee, Hyun-joong Kim, Bum Kim, Joon Kim, So-eun Kim, Hye-yeong Lee, Jin-bin Park, Ye-jin Lim, Ho-bin Jeong",South Korea,"May 1, 2018",2009,TV-14,1 Season,"International TV Shows, Korean TV Shows, Romantic TV Shows",Unassuming high school girl Jan-di stands up to – and eventually falls for – a spoiled rich kid who belongs to the school's most powerful clique.
34,80081705,TV Show,Iris,,"Byung-hun Lee, Tae-hee Kim, Jun-ho Jeong, Yeong-cheol Kim, Kim Seung-woo, So-yeon Kim, Ju-sang Yun, Jeong-Kil Lee",South Korea,"May 1, 2018",2009,TV-MA,1 Season,"International TV Shows, Korean TV Shows, TV Action & Adventure",Two friends' lives are changed forever when they are recruited by a top-secret organization tasked with protecting the country from foreign threats.
35,80066146,TV Show,Love Rain,,"Keun-suk Jang, Yoon-ah Im, Shi-hoo Kim, Eun-seo Son, In-guk Seo, Bo-ra Hwang, Jin-young Jung, Mi-sook Lee",South Korea,"May 1, 2018",2012,TV-PG,1 Season,"International TV Shows, Korean TV Shows, Romantic TV Shows","A story of two couples' journey of new love, loss and unexpected reunion spans decades, from the 1970s through present day."
36,80214772,TV Show,Bad Guys: Vile City,,"Joong-hoon Park, Jin-mo Joo, Yang Ik-june, Moo-Yul Kim, Ji Soo, Young-chang Song, Hong-Fa Kim, Tae-ho Ryu, Yu-seok Kim, Soo-young Park, Yoon-hee Lee",South Korea,"March 8, 2018",2018,TV-MA,1 Season,"Crime TV Shows, International TV Shows, Korean TV Shows","Ordered to take down a villainous business leader who controls the city, a prosecutor gathers a team of men who may not be so clean themselves."
37,80214405,TV Show,A Korean Odyssey,,"Lee Seung-gi, Cha Seung-won, Oh Yeon-seo, Lee Hong-gi, Jang Gwang, Lee Se-young",South Korea,"March 5, 2019",2017,TV-MA,1 Season,"International TV Shows, Korean TV Shows, Romantic TV Shows",A self-serving mythical creature's bid for invincibility backfires when he finds himself at the mercy of a woman who can see otherworldly beings.
38,80094387,TV Show,A Man Called God,,"Song Il-gook, Han Chae-young, Kim Min-jong, Go Eun Han, Jung Hoon Lee, Nam Da-Reum, Yoo In-young",South Korea,"March 12, 2019",2010,TV-MA,1 Season,"Crime TV Shows, International TV Shows, Korean TV Shows","Raised in America, government agent Choi Kang-Ta returns to Korea with the skills of an assassin and a thirst for revenge on his father’s killers."
39,80094386,TV Show,Cain and Abel,,"So Ji-sub, Shin Hyun-joon, Chae Jung-an, Han Ji-min, Kim Hae-suk, You-Mi Ha, Yong Jang, Kwon Hae-hyo",South Korea,"March 12, 2019",2009,TV-14,1 Season,"International TV Shows, Korean TV Shows, Romantic TV Shows",Gifted doctor Cho-in leads a charmed life while his older brother Seon-woo seethes with jealousy in this series inspired by Biblical characters.
40,80161700,TV Show,One More Time,,"L, So-hui Yoon, Gi-du Kim, Chang-hwan Kim, Ji Su, Tae-im Lee, Nam-gil Kang",South Korea,"March 10, 2017",2016,TV-14,1 Season,"International TV Shows, Korean TV Shows, Romantic TV Shows",This fantasy drama follows an indie band singer who repeatedly undergoes unwanted time slips and the girlfriend he must save from an unlucky fate.
41,80158817,TV Show,Tong: Memories,,"Lee Hak Joo, Ji-an Kim, Jae-yoon Lee, Heo Ji Won, Yang Hak Jin, Choi Yeong Min",South Korea,"March 1, 2017",2016,TV-14,1 Season,"International TV Shows, Korean TV Shows, TV Action & Adventure",A tough young man with a short temper and no patience for bullies gains a legendary reputation as the best street fighter in Busan.
42,80178564,TV Show,My Only Love Song,,"Seung-yeon Gong, Jong-hyun Lee, Yeon-seo Kim, Bo-hyun Ahn, Jai-jin Lee, Joo-hyung Park",South Korea,"June 9, 2017",2017,TV-MA,1 Season,"International TV Shows, Korean TV Shows, Romantic TV Shows","When things don't go her way during a shooting for her new show, a top actress runs away in an old van that guides her on a time-traveling journey."
43,81028895,TV Show,Arthdal Chronicles,,"Song Joong-ki, Jang Dong-gun, Kim Ji-won, Kim Ok-vin, Kim Eui-sung, Cho Seong-ha, Lee Do-gyeong, Park Hae-joon, Park Byung-eun",South Korea,"June 2, 2019",2019,TV-14,1 Season,"International TV Shows, Korean TV Shows, TV Action & Adventure","In a mythical land called Arth, the inhabitants of the ancient city of Arthdal and its surrounding regions vie for power as they build a new society."
44,80176840,TV Show,The Homecoming,,"Se-yoon Yoo, Tyler Rasch, Guillaume Patry, Nikolai Johnsen",,"June 2, 2017",2015,TV-PG,1 Season,"International TV Shows, Korean TV Shows, Reality TV","Panelists from the Korean show ""Abnormal Summit"" lead cast mates on tours of their home countries, including China, Nepal, Italy, Canada and France."
45,80163409,TV Show,28 Moons,,"Jin-sung Yang, Kyu-jong Kim, Tae-hwan Kang, Geummi",,"June 10, 2017",2016,TV-14,1 Season,"International TV Shows, Korean TV Shows, Romantic TV Shows","When her fiancé acts strangely upon receiving a mysterious invitation, a florist sets out to find out the truth behind the tiny scrap of paper."
46,80163277,TV Show,Magic Phone,,"Jin-woo Kim, Min-ji Park, In-jun Gwak, Gi-du Kim",South Korea,"June 10, 2017",2016,TV-14,1 Season,"International TV Shows, Korean TV Shows, Romantic TV Shows","When an ordinary guy crosses paths 15 years later with his childhood sweetheart, now an actress, a magic cellphone allows him to be her protector."
47,80176866,TV Show,Man to Man,Chang-Min Lee,"Hae-Jin Park, Sung-woong Park, Min-jung Kim, Jung-an Chae, Jung-hoon Yeon, Hyun-sung Jang, Man-sik Jung, Shin-il Kang, Ho-jin Chun, In-ho Tae",South Korea,"June 10, 2017",2017,TV-14,1 Season,"Crime TV Shows, International TV Shows, Korean TV Shows","Disguised as a bodyguard, a special agent must complete his national secret tasks while pandering to the whims of his ill-tempered world star."
48,80162114,TV Show,My Little Baby,,"Ji-ho Oh, Soo-kyung Lee, Min-jae Kim, Ji-hyun Nam",South Korea,"June 10, 2017",2016,TV-14,1 Season,"Crime TV Shows, International TV Shows, Korean TV Shows",A top detective in the violent crimes unit becomes the sole guardian of his 6-month-old niece when his sister and her husband pass away unexpectedly.
49,80163266,TV Show,Under the Black Moonlight,,"Tae-hyun Nam, Soo-yeon Kim, Seo-ra Kim, Tae-hwan Kang, Young-jo Yang",South Korea,"June 10, 2017",2016,TV-14,1 Season,"International TV Shows, Korean TV Shows, TV Dramas",A college art club welcomes a new member who has the secret ability to smell death and who warns one of them to leave her boyfriend ... or else.
50,80176449,TV Show,Miniforce,,"Sang-hyun Um, Jeong-hwa Yang, Tae-yeol Jeon, Yong-woo Shin, So-yeong Lee, Wan-kyung Sung, Soyeon, Jin-wook Hong, Yeong-wung Jeong",,"June 1, 2017",2016,TV-Y7,1 Season,"Kids' TV, Korean TV Shows",Four animal superheroes called the Miniforce transform into robots to protect small and defenseless creatures from the hands of scheming villains.
51,80175277,TV Show,Power Battle Watch Car,,"Sang-hyun Um, Tae-yeol Jeon, Yeong-wung Jeong, Hye-won Jeong, Yong-woo Shin, Jin-hong Bae, Do-hyeong Nam, Min-kyu Lee",,"June 1, 2017",2016,TV-Y7,1 Season,"Kids' TV, Korean TV Shows","Jino and his Watch Car, Bluewill, compete in the Battle League to become world champions. Meanwhile, a dark force threatens to destroy them all."
52,80991107,TV Show,Mr. Sunshine,Lee Eung-bok,"Lee Byung-hun, Kim Tae-ri, Yoo Yeon-seok, Kim Min-jung, Byun Yo-han",South Korea,"July 8, 2018",2018,TV-MA,1 Season,"International TV Shows, Korean TV Shows, Romantic TV Shows",A young boy who ends up in the U.S. after the 1871 Shinmiyangyo incident returns to Korea at a historical turning point and falls for a noblewoman.
53,81072109,TV Show,Designated Survivor: 60 Days,,"Ji Jin-hee, Lee Jun-hyuk, Heo Jun-ho, Kang Han-na, Bae Jong-ok, Kim Gyu-ri, Son Suk-ku, Choi Yoon-young, Lee Moo-saeng",South Korea,"July 2, 2019",2019,TV-14,1 Season,"International TV Shows, Korean TV Shows, TV Dramas","When the National Assembly suffers a catastrophic attack, Minister of Environment Park Mu-jin must find a way to lead Korea through the ensuing chaos."
54,81116487,TV Show,Rookie Historian Goo Hae-Ryung,,"Shin Sae-kyeong, Cha Eun-woo, Park Ki-woong, Lee Ji-hoon, Park Ji-hyun, Gong Jung-hwan, Kim Min-sang, Choi Duk-mun, Kim Yeo-jin",South Korea,"July 18, 2019",2019,TV-14,1 Season,"International TV Shows, Korean TV Shows, Romantic TV Shows",Free spirit Goo Hae-ryung embarks on a new life as a scholar in the Joseon royal court after hearing about a government post for women historians.
55,81094069,TV Show,One Spring Night,,"Han Ji-min, Jung Hae-in, Kim Jun-han, Yim Sung-eon, Song Seung-hwan, Kil Hae-yeon, Lee Moo-saeng, Kim Chang-wan",South Korea,"July 12, 2019",2019,TV-14,1 Season,"International TV Shows, Korean TV Shows, Romantic TV Shows","When Lee Jeong-in and Yu Ji-ho meet, something unexpected happens. Or it just may be that spring is in the air – and anything is possible."
56,81099997,TV Show,Flowering Heart,,"Choi Da-in, Yang Se-na, Gim Chae-eun, Esther, Um Sang-hyun, Shin Yong-woo",South Korea,"July 1, 2019",2016,TV-Y7,1 Season,"Kids' TV, Korean TV Shows","An ordinary student, who forms an advice club with her friends to help others, gains special powers after a mysterious encounter."
57,81100120,TV Show,Stone Age,,"Samantha Moon, Nancy Kim, Jacqueline Youn, Mike Yantzi, Anna Paik, Matt Anipen, Josh Schwartzentruber",,"July 1, 2019",2017,TV-Y7,1 Season,"Kids' TV, Korean TV Shows","Woody sets out to become the Stone Age's best animal trainer with a little help from his faithful pet dinosaur, Moga."
58,81099976,TV Show,Titipo Titipo,,"Jeon Hae-ri, Kim Eun-ah, Hong Bum-ki, Nam Do-hyeong, Um Sang-hyun",,"July 1, 2019",2018,TV-Y,1 Season,"Kids' TV, Korean TV Shows",Titipo the train is out to prove that he's got what it takes to help the folks of Train Village ride the rails safely and reliably.
59,80116687,TV Show,Momo Salon,,"Lizzy, Jung-min Park, Sang-hee Lee",South Korea,"July 1, 2017",2014,TV-14,1 Season,"International TV Shows, Korean TV Shows, Romantic TV Shows","An aspiring hair stylist opens her own salon. It turns into a mail-holding hub for busy neighbors, but she seizes the chance to promote her business."
60,70251160,TV Show,Operation Proposal,,"Seung-ho Yoo, Eun-bin Park, Kyung-pyo Go, Ye-won Kim, Hyun Jin Lee, Jin-joo Park",South Korea,"July 1, 2016",2012,TV-PG,1 Season,"International TV Shows, Korean TV Shows, Romantic TV Shows","On Yi-seul's wedding day, her friend Baek-ho wishes he could turn back time to tell her he loves her. Soon he gets a chance to change everything."
61,80226168,TV Show,The Lady in Dignity,,"Hee-seon Kim, Seon-a Kim, Sang-hun Jeong, Tae-im Lee, Ki-woo Lee",South Korea,"January 30, 2018",2017,TV-MA,1 Season,"International TV Shows, Korean TV Shows, TV Dramas",The wife of a corporate heir finds her luxurious life overturned by a mysterious woman who joins the household as a caregiver for her father-in-law.
62,80180171,TV Show,Kingdom,Kim Seong-hun,"Ju Ji-hoon, Ryu Seung-ryong, Bae Doona, Kim Sang-ho, Kim Sung-kyu, Jeon Seok-ho, Kim Hye-jun, Heo Jun-ho, Jung Suk-won, Kim Jong-soo","South Korea, United States","January 25, 2019",2019,TV-MA,1 Season,"International TV Shows, Korean TV Shows, TV Action & Adventure","While strange rumors about their ill king grip a kingdom, the crown prince becomes their only hope against a mysterious plague overtaking the land."
63,80214406,TV Show,Prison Playbook,,"Hae-soo Park, Kyung-ho Jung, Dong-il Sung, Krystal Jung, Soo-jeong Ye, Jae-sung Jung, Hoon-jin Lee, Kyoo-hyung Lee, Ho-cheol Lee, Chang-hwan Ahn, Kyung-nam Kim",South Korea,"January 24, 2018",2017,TV-MA,1 Season,"International TV Shows, Korean TV Shows, TV Comedies","With his major league baseball debut right around the corner, a star pitcher lands in prison and must learn to navigate his new world."
64,81167119,TV Show,Because This Is My First Life,,"Lee Min-ki, Jung So-min, Esom, Kim Ga-eun, Park Byung-eun, Kim Min-seok, Moon Hee-kyung, Kim Byung-ok, Kim Sun-young",South Korea,"January 1, 2020",2017,TV-14,1 Season,"International TV Shows, Korean TV Shows, Romantic TV Shows","Two housemates get married for financial convenience, but discover nothing is simple when it comes to demanding in-laws, or facing their growing bond."
65,81167137,TV Show,Live Up To Your Name,,"Kim Nam-gil, Kim Ah-joong, Yoo Min-kyu, Moon Ga-young, Yun Ju-sang, Um Hyo-sup, An Seok-hwan, Lee Dae-yeon, Oh Dae-whan",,"January 1, 2020",2017,TV-14,1 Season,"International TV Shows, Korean TV Shows, TV Dramas","Pushed together by twists of time, a Joseon doctor and a cardiac surgeon overcome their 400-year divide as they learn and heal through each other."
