index,show_id,type,title,director,cast,country,date_added,release_year,rating,duration,listed_in,description
587,70056728,Movie,Ahista Ahista,Shivam Nair,"Abhay Deol, Soha Ali Khan, Shayan Munshi, Kamini Khanna, Sohrab Ardeshir, Murad Ali, Shakeel Khan, Natasha Sinha, Brijendra Kala",India,"December 31, 2019",2006,TV-14,122 min,"Dramas, International Movies, Romantic Movies","Stood up by her groom at the altar, a young woman finds help and healing from another man – until her ex-fiancé returns, hoping to win her back."
588,81161834,Movie,Albert Pinto Ko Gussa Kyun Aata Hai?,Soumitra Ranade,"Nandita Das, Manav Kaul, Saurabh Shukla, Kishore Kadam, Omkar Das Manikpuri, Amarjeet Amle, Yusuf Hussain, Sushma Bakshi",India,"December 31, 2019",2019,TV-MA,85 min,"Dramas, Independent Movies, International Movies","As the police investigate his disappearance, a young man heads to Goa to carry out an act of vengeance fueled by years of pent-up anger toward society."
589,247747,Movie,Amar Akbar Anthony,Manmohan Desai,"Vinod Khanna, Rishi Kapoor, Amitabh Bachchan, Neetu Singh, Parveen Babi, Shabana Azmi, Nirupa Roy, Pran",India,"December 31, 2019",1977,TV-14,172 min,"Action & Adventure, Classic Movies, Comedies","Abandoned in a park by their father, Amar, Akbar and Anthony grow up independently and have no knowledge of one another. They're reunited as adults when, by coincidence, they all give blood at the same hospital."
590,70064205,Movie,Anwar,Manish Jha,"Siddharth Koirala, Nauheed Cyrusi, Manisha Koirala, Rajpal Yadav, Yashpal Sharma, Vijay Raaz, Hiten Tejwani, Sudhir Pandey, Sanjay Mishra, Lalit Tiwari",India,"December 31, 2019",2007,TV-14,134 min,"Dramas, Independent Movies, International Movies","Seeking refuge in a Hindu temple after the tragic death of the girl he loved, a Muslim youth is caught by the police, who mistake him for an enemy."
591,80083672,Movie,Barah Aana,Raja Menon,"Naseeruddin Shah, Arjun Mathur, Vijay Raaz, Tannishtha Chatterjee, Violante Placido, Benjamin Gilani",India,"December 31, 2019",2009,TV-14,95 min,"Dramas, International Movies","After futile attempts to better their lives with honest work, three broke friends opt for a more dubious means of making money: kidnapping for ransom."
592,60003405,Movie,Bawarchi,Hrishikesh Mukherjee,"Rajesh Khanna, A.K. Hangal, Durga Khote, Jaya Bhaduri, Kali Bannerjee, Usha Kiran, Asrani, Paintal",India,"December 31, 2019",1972,TV-PG,125 min,"Classic Movies, Comedies, Dramas",A dysfunctional middle-class family is transformed by the attentions of their talented new chef – until he vanishes along with their valuable jewels.
593,70053010,Movie,Bazaar,Sagar Sarhadi,"Farooq Shaikh, Smita Patil, Naseeruddin Shah, Bharat Kapoor, Supriya Pathak, Rita Rani Kaul, Malika",India,"December 31, 2019",1982,TV-14,121 min,"Dramas, Independent Movies, International Movies","A young man challenges traditional customs by standing up to the father of the woman he loves, who has promised her to a wealthy expatriate."
594,70062701,Movie,Bhagam Bhag,Priyadarshan,"Akshay Kumar, Govinda, Lara Dutta, Paresh Rawal, Rajpal Yadav, Jackie Shroff, Arbaaz Khan, Tanushree Dutta, Asrani, Shakti Kapoor",India,"December 31, 2019",2006,TV-14,151 min,"Comedies, International Movies, Romantic Movies","A theater group lands in trouble when its new actress takes her own life, two of its members are framed for murder and no one is who they appear to be."
595,81213889,Movie,Bhoot,Ram Gopal Varma,"Ajay Devgn, Urmila Matondkar, Nana Patekar, Rekha, Fardeen Khan, Victor Banerjee, Tanuja, Seema Biswas",India,"December 31, 2019",2003,TV-MA,114 min,"Horror Movies, International Movies, Thrillers","After a couple moves into an apartment, the wife’s increasingly disturbing behavior unravels chilling secrets about their new home’s past."
596,70005055,Movie,Bobby,Raj Kapoor,"Rishi Kapoor, Dimple Kapadia, Pran, Prem Nath, Sonia Sahni, Durga Khote, Aruna Irani, Prem Chopra, Farida Jalal",India,"December 31, 2019",1973,TV-14,168 min,"Classic Movies, Dramas, International Movies","Raj, the son of strict, wealthy parents, falls in love with Bobby, the daughter of a poor Christian fisherman – a romance his parents oppose."
597,81213893,Movie,Chal Mere Bhai,David Dhawan,"Sanjay Dutt, Salman Khan, Karisma Kapoor, Dalip Tahil, Sushma Seth, Shakti Kapoor, Nagma, Sonali Bendre, Twinkle Khanna, Ravi Baswani",India,"December 31, 2019",2000,TV-14,132 min,"Comedies, International Movies, Romantic Movies","When a secretary saves her tycoon boss's life, his family hears wedding bells. Problem is, she's already in love – with his younger brother."
598,20255593,Movie,Chupke Chupke,Hrishikesh Mukherjee,"Dharmendra, Sharmila Tagore, Amitabh Bachchan, Jaya Bhaduri, Om Prakash, Asrani, David Abraham, Usha Kiran, Lily Chakravarty, Keshto Mukherjee",India,"December 31, 2019",1975,TV-PG,127 min,"Classic Movies, Comedies, International Movies","Jealous of the high regard in which his new wife holds their brother-in-law, a botany professor stages an elaborate prank that will even the score."
599,70059328,Movie,Deadline: Sirf 24 Ghante,Tanveer Khan,"Irrfan Khan, Konkona Sen Sharma, Rajit Kapoor, Sandhya Mridul, Zakir Hussain, Rajeev Verma, Princey Shukla",India,"December 31, 2019",2006,TV-14,97 min,"Independent Movies, International Movies, Thrillers",A surgeon’s perfect life is rattled when his daughter is taken hostage in their own home and he's given 24 hours to pay a hefty ransom.
600,81213888,Movie,Dhamaal,Indra Kumar,"Sanjay Dutt, Riteish Deshmukh, Arshad Warsi, Aashish Chaudhary, Javed Jaffrey, Prem Chopra, Asrani, Tiku Talsania",India,"December 31, 2019",2007,TV-14,128 min,"Action & Adventure, Comedies, International Movies","Tipped off about buried money in Goa, four ne’er-do-well friends go on the hunt, chased by a police officer who wants the treasure for himself."
601,20255837,Movie,Don,Chandra Barot,"Amitabh Bachchan, Zeenat Aman, Pran, Iftekhar, Om Shivpuri, Satyendra Kapoor, P. Jairaj, Kamal Kapoor, Arpana Choudhry, Helen",India,"December 31, 2019",1978,TV-14,158 min,"Action & Adventure, Classic Movies, Dramas",A man who's a lookalike for a slain mob kingpin is asked by the police to impersonate the gangster and infiltrate his underworld organization.
602,70006866,Movie,Encounter: The Killing,Ajay Phansekar,"Naseeruddin Shah, Tara Deshpande, Akash Khurana, Ratna Pathak Shah, Dilip Prabhavalkar, Avtar Gill",India,"December 31, 2019",2002,TV-14,151 min,"Dramas, Independent Movies, International Movies","After accidentally killing a young mobster, a guilt-stricken police officer searches for the parents who never came forward to claim their son's body."
603,20077944,Movie,Ghayal,Rajkumar Santoshi,"Sunny Deol, Meenakshi Sheshadri, Amrish Puri, Moushumi Chatterjee, Kulbhushan Kharbanda, Om Puri, Raj Babbar, Shabbir Khan",India,"December 31, 2019",1990,TV-14,163 min,"Action & Adventure, Dramas, International Movies","Framed for his older brother's murder, a boxer seeks violent revenge against the true killer who's torn his family apart."
604,20705133,Movie,Ghulam-E-Musthafa,Partho Ghosh,"Nana Patekar, Raveena Tandon, Paresh Rawal, Aruna Irani, Mohan Joshi, Mohnish Bahl, Shivaji Satham, Vishwajeet Pradhan, Ashwin Kaushal, Satish Shah",India,"December 31, 2019",1997,TV-MA,161 min,"Action & Adventure, Dramas, International Movies","Giving up his life of crime for love, a gangster struggles with a moral dilemma when tragic events and enduring enemies take him back to the underworld."
605,21028086,Movie,Gol Maal,Hrishikesh Mukherjee,"Amol Palekar, Bindiya Goswami, Deven Verma, Utpal Dutt, Shubha Khote, Manju Singh, Dina Pathak, Pushpa, David Abraham, Asrani",India,"December 31, 2019",1979,TV-PG,137 min,"Classic Movies, Comedies, International Movies","When circumstances at work compel Ram to pretend to have a twin, his lie works – until the boss wants his daughter to marry Ram’s fictitious brother."
606,70054380,Movie,Golmaal: Fun Unlimited,Rohit Shetty,"Ajay Devgn, Tusshar Kapoor, Arshad Warsi, Sharman Joshi, Paresh Rawal, Rimi Sen, Sushmita Mukherjee, Vrajesh Hirjee",India,"December 31, 2019",2006,TV-14,148 min,"Comedies, International Movies","Between thwarting crooks and wooing the belle next door, four pranksters get in over their heads when they bamboozle their way into a couple’s bungalow."
607,20765027,Movie,Hera Pheri,Prakash Mehra,"Amitabh Bachchan, Vinod Khanna, Saira Banu, Sulakshana Pandit, Shreeram Lagoo, Pinchoo Kapoor, P. Jairaj, Yunus Parvez",India,"December 31, 2019",1976,TV-14,156 min,"Action & Adventure, Comedies, Dramas",The bond between two crooks and best friends is threatened when one learns that the other's father had a hand in his own tragic past.
608,81213885,Movie,Jaan-E-Mann: Let's Fall in Love... Again,Shirish Kunder,"Salman Khan, Akshay Kumar, Preity Zinta, Anupam Kher, Aman Verma, Javed Sheikh, Soni Razdan, Nawab Shah",India,"December 31, 2019",2006,TV-14,163 min,"Dramas, International Movies, Romantic Movies","To avoid alimony payments, an aspiring actor schemes for his ex-wife to marry an unlikely suitor, but soon realizes he may not be ready to lose her."
609,70129075,Movie,Jail,Madhur Bhandarkar,"Neil Nitin Mukesh, Manoj Bajpayee, Mugdha Godse, Arya Babbar, Chetan Pandit, Rahul Singh, Navni Parihar, Manish Mehta",India,"December 31, 2019",2009,TV-14,132 min,"Dramas, International Movies","Incarcerated for a crime he didn’t commit, a young man must navigate the crowded, cut-throat environment of prison as he awaits trial."
610,70295531,Movie,John Day,Ahishor Solomon,"Naseeruddin Shah, Randeep Hooda, Shernaz Patel, Elena Kazan, Sharat Saxena, Vipin Sharma, Denzil Smith, Kenneth Desai, Sushil Pandey",India,"December 31, 2019",2013,TV-MA,125 min,"International Movies, Thrillers","A bank manager and his wife, still grieving over their daughter who died in a fire, become pawns in a bank heist with ties to corruption and fraud."
611,17457622,Movie,Judwaa,David Dhawan,"Salman Khan, Karisma Kapoor, Rambha, Kader Khan, Anupam Kher, Shakti Kapoor, Bindu, Reema Lagoo, Satish Shah, Mukesh Rishi",India,"December 31, 2019",1997,TV-14,133 min,"Comedies, International Movies, Romantic Movies","Separated at birth, a pair of identical twins unexpectedly reunite as adults and embark on a madcap mission to take down a common enemy from their past."
612,20712279,Movie,Kaalia,Tinnu Anand,"Amitabh Bachchan, Asha Parekh, Parveen Babi, Amjad Khan, Pran, K.N. Singh, Sajjan, Murad, Kader Khan, Jagdeep",India,"December 31, 2019",1981,TV-14,173 min,"Action & Adventure, Dramas, International Movies","Jailed for robbing his brother’s unscrupulous employer, a simpleton has a transformation while in prison, emerging with a violent mission for revenge."
613,70051840,Movie,Katha,Sai Paranjape,"Farooq Shaikh, Naseeruddin Shah, Deepti Naval, Veeni Paranjape Joglekar, Mallika Sarabhai, Arun Joglekar",India,"December 31, 2019",1982,TV-PG,140 min,"Comedies, Dramas, Independent Movies","Secretly in love with his neighbor, a mild-mannered clerk is heartbroken when his much bolder, more charming friend wins her heart instead."
614,81213895,Movie,Khubsoorat,Hrishikesh Mukherjee,"Ashok Kumar, Rekha, Rakesh Roshan, Shashikala, Aradhana, Dina Pathak, David Abraham, S.N. Banerjee, Keshto Mukherjee",India,"December 31, 2019",1980,TV-PG,120 min,"Classic Movies, Comedies, Dramas",A strict matriarch's regimented household is upended by the arrival of a spunky relative who challenges the rules.
615,24073896,Movie,Koshish,Gulzar,"Sanjeev Kumar, Jaya Bhaduri, Asrani, Seema, Om Shivpuri, Dina Pathak",India,"December 31, 2019",1972,TV-14,115 min,"International Movies, Romantic Movies",A speech and hearing-impaired couple persists through unforgiving obstacles to be accepted by society and live a life of dignity.
616,81221913,Movie,Kuldip Patwal: I Didn't Do It!,Remy Kohli,"Deepak Dobriyal, Gulshan Devaiah, Raima Sen, Parvin Dabas, Anurag Arora, Jameel Khan, Priyanka Setia",India,"December 31, 2019",2017,TV-MA,126 min,"Dramas, Independent Movies, International Movies","Accused of killing a politician, a local grocer’s fight to prove his innocence reveals his lifelong struggles with injustice leading up to the incident."
617,70040912,Movie,Maine Pyaar Kyun Kiya,David Dhawan,"Salman Khan, Sushmita Sen, Sohail Khan, Katrina Kaif, Arshad Warsi, Isha Koppikar, Rajpal Yadav, Beena Kak",India,"December 31, 2019",2005,TV-14,137 min,"Comedies, International Movies, Music & Musicals","After lying to his girlfriend, orthopedic surgeon Samir must conjure up a pretend wife in this musical comedy."
618,81213979,Movie,Masoom,Shekhar Kapur,"Shabana Azmi, Naseeruddin Shah, Saeed Jaffrey, Jugal Hansraj, Urmila Matondkar, Aradhana Srivastav, Tanuja, Supriya Pathak",India,"December 31, 2019",1983,TV-14,138 min,"Dramas, Independent Movies, International Movies",A loving husband and father's joyful family life is rocked to its core upon the discovery that he has a young son borne from a past extramarital affair.
619,70018445,Movie,Mujhse Shaadi Karogi,David Dhawan,"Rajpal Yadav, Amrish Puri, Kader Khan, Shashi Kala, Priyanka Chopra, Salman Khan, Akshay Kumar, Satish Shah",India,"December 31, 2019",2004,TV-PG,158 min,"Comedies, International Movies, Romantic Movies","Samir must overcome a hostile horoscope, a hot temper and a determined rival to win the heart of Rani, the love of his life."
620,81213897,Movie,Namak Halaal,Prakash Mehra,"Amitabh Bachchan, Shashi Kapoor, Parveen Babi, Smita Patil, Waheeda Rehman, Om Prakash, Ranjeet, Satyendra Kapoor",India,"December 31, 2019",1982,TV-14,171 min,"Action & Adventure, Comedies, International Movies","While loyally defending his boss from mobsters trying to kill him, a naive, hotel bellboy discovers the family he never knew he had."
621,81213882,Movie,Phullu,Abhishek Saxena,"Sharib Hashmi, Nutan Surya, Jyotii Sethi, Inaamulhaq, Trisha Kale, Namya Saxena, Shivam Pradhan, Kimti Anand, Paras Raj Gandhi",India,"December 31, 2019",2017,TV-14,96 min,"Dramas, Independent Movies, International Movies","Struck by the lack of clean resources for menstruating women in his village, a jobless loafer braves social stigmas to create low-cost sanitary napkins."
622,81213896,Movie,Rajnigandha,Basu Chatterjee,"Vidya Sinha, Amol Palekar, Dinesh Thakur, Ranjita Thakur, Veena Gaud, Manju Maini",India,"December 31, 2019",1974,TV-PG,104 min,"Comedies, Dramas, Independent Movies","A grad student leaves her boyfriend in Delhi for a job interview in Mumbai, where she reconnects with an old flame for whom she still has feelings."
623,60003097,Movie,Ram Teri Ganga Maili,Raj Kapoor,"Mandakini, Rajiv Kapoor, Divya Rana, Saeed Jaffrey, Kulbhushan Kharbanda, Raza Murad, Sushma Seth, Trilok Kapoor",India,"December 31, 2019",1985,TV-14,178 min,"Classic Movies, Dramas, International Movies","Abandoned by her new husband and father of her son, a mountain woman journeys to Calcutta to find him, constantly tested by social evils along the way."
624,81213887,Movie,Ramji Londonwaley,Sanjay Dayma,"Madhavan, Samita Bangargi, Harsh Chhaya, Rajendranath Zutshi, Shikha Shalu Varma, Satish Shah, Akhilendra Mishra",India,"December 31, 2019",2005,TV-14,154 min,"Comedies, Dramas, International Movies","A small-town cook moves to London to earn a living, but from his employer’s sudden death to the immigration officials on his trail, plans soon go sour."
625,81217436,Movie,Road to Sangam,Amit Rai,"Paresh Rawal, Om Puri, Pavan Malhotra, Javed Sheikh, Swati Chitnis, Masood Akhtar, Sudhir Nema, Rakesh Srivastava",India,"December 31, 2019",2010,TV-14,136 min,"Dramas, Independent Movies, International Movies","As communal violence erupts in his neighborhood, a Muslim mechanic presses forward to repair a historic truck that will transport Gandhi’s last remains."
626,81221914,Movie,Saath Saath,Raman Kumar,"Deepti Naval, Farooq Shaikh, Satish Shah, Iftekhar, A.K. Hangal, Neena Gupta, Avtar Gill, Javed Khan",India,"December 31, 2019",1982,TV-14,118 min,"Dramas, Independent Movies, International Movies","A young woman falls for her classmate’s idealistic, non-materialistic ways, but is troubled upon seeing his principles change after they marry."
627,70072558,Movie,Sadma,Balu Mahendra,"Kamal Hassan, Sridevi, Silk Smitha, Gulshan Grover, Paintal, Arvind Deshpande",India,"December 31, 2019",1983,TV-14,137 min,"Dramas, International Movies, Romantic Movies","After a traumatic injury leaves her with amnesia and age regression, a young woman is sold to a brothel before a teacher becomes her savior."
628,60002818,Movie,Sangam,Raj Kapoor,"Raj Kapoor, Vyjayanthimala, Rajendra Kumar, Lalita Pawar, Achala Sachdev, Hari Shivdasani, Raj Mehra, Iftekhar",India,"December 31, 2019",1964,TV-14,228 min,"Classic Movies, Dramas, International Movies","Returning home from war after being assumed dead, a pilot weds the woman he has long loved, unaware that she had been planning to marry his best friend."
629,20257617,Movie,Satte Pe Satta,Raj N. Sippy,"Amitabh Bachchan, Hema Malini, Amjad Khan, Sachin, Shakti Kapoor, Ranjeeta Kaur, Paintal, Ranjeet",India,"December 31, 2019",1982,TV-14,153 min,"Comedies, Cult Movies, Dramas","The eldest of seven brothers who run a family farm together marries a pretty nurse, inspiring his country-bumpkin siblings to follow his example."
630,70059284,Movie,Shiva,Ram Gopal Varma,"Nagarjuna Akkineni, Amala, Rajendranath Zutshi, Raghuvaran, Paresh Rawal, Brij Gopal, J.D. Chakravarthi, Tanikella Bharani",India,"December 31, 2019",1990,TV-MA,168 min,"Action & Adventure, Dramas, International Movies","A young man enrolls at a college and becomes a rival to the student-union president, who’s using force and intimidation to advance his criminal agenda."
631,60001404,Movie,Swami,Basu Chatterjee,"Shabana Azmi, Girish Karnad, Vikram, Dheeraj Kumar, Shashikala, Utpal Dutt, Preeti Ganguli, Sudha Shivpuri",India,"December 31, 2019",1977,TV-PG,123 min,"Dramas, Independent Movies, International Movies","After she enters into an arranged marriage, a spirited and intellectual young woman tries to adjust to life with a man who was not her choice."
632,81213879,Movie,The Dark Side of Life: Mumbai City,Tariq Khan,"Mahesh Bhatt, Kay Kay Menon, Avii, Nikhil Ratnaparkhi, Neha Khan, Alisha Khan, Irfan Hussein, Jyoti Malshe, Sayed Gul",India,"December 31, 2019",2018,TV-MA,121 min,"Dramas, International Movies","Struggling with Mumbai's pressures and private battles with depression, six lives intersect just as they reach a breaking point."
633,81213898,Movie,The Great Gambler,Shakti Samanta,"Amitabh Bachchan, Zeenat Aman, Neetu Singh, Prem Chopra, Utpal Dutt, Madan Puri, Om Shivpuri, Iftekhar, Sujit Kumar, Roopesh Kumar",India,"December 31, 2019",1979,TV-14,161 min,"Action & Adventure, Classic Movies, Cult Movies","After unwittingly using his skills to obtain military secrets, a gambler is pursued by a police officer who happens to be his doppelgänger."
634,70065255,Movie,Traffic Signal,Madhur Bhandarkar,"Kunal Khemu, Neetu Chandra, Konkona Sen Sharma, Upendra Limaye, Ranvir Shorey, Sudhir Mishra, Nassar Abdulla, Manoj Joshi",India,"December 31, 2019",2007,TV-MA,130 min,"Dramas, Independent Movies, International Movies","Four characters coexist at an urban traffic signal, where all manage to make a meager living until events threaten the source of their livelihood."
635,60021548,Movie,"Trikal (Past, Present, Future)",Shyam Benegal,"Leela Naidu, Neena Gupta, Anita Kanwar, Soni Razdan, Dalip Tahil, K.K. Raina, Kunal Kapoor, Keith Stevenson, Naseeruddin Shah, Kulbhushan Kharbanda",India,"December 31, 2019",1985,TV-14,134 min,"Comedies, Dramas, Independent Movies","A Goan native returns to his now-derelict, palatial childhood home, recalling his family’s interpersonal drama during the end of Portuguese rule."
636,81217438,Movie,Union Leader,Sanjay Patel,"Rahul Bhat, Tillotama Shome, Haresh Dagiya, Jayesh More, Tirth Sharma, Vivek Ghamande, Jay Vithlani, Mehul Buch","Canada, India","December 31, 2019",2017,TV-14,105 min,"Dramas, Independent Movies, International Movies",Toxic conditions and a corrupt union leader prompt a chemical plant worker and earnest family man to fight for justice for his fellow laborers.
637,81213873,Movie,Veerey Ki Wedding,Ashu Trikha,"Pulkit Samrat, Yuvika Chaudhry, Jimmy Shergill, Supriya Karnik, Kriti Kharbanda, Satish Kaushik",India,"December 31, 2019",2018,TV-14,130 min,"Comedies, Dramas, International Movies","Quick to throw punches in the name of justice, a young man must find a calmer way to win over the pacifist father of the girl he wishes to marry."
638,81213874,Movie,Vodka Diaries,Kushal Srivastava,"Kay Kay Menon, Raima Sen, Mandira Bedi, Sharib Hashmi, Rishi Bhutani, Herry Tangri, Vaishnavi Dhanraj, Swati Rajput",India,"December 31, 2019",2018,TV-14,113 min,"Dramas, International Movies, Thrillers","While investigating a series of murders and the nightclub that links them, a detective’s case takes an alarming turn when his wife goes missing."
639,81213884,Movie,Zed Plus,Chandra Prakash Dwivedi,"Adil Hussain, Mona Singh, K.K. Raina, Sanjay Mishra, Anil Rastogi, Ravi Jhankal, Kulbhushan Kharbanda, Ekavali Khanna, Mukesh Tiwari, Vinod Acharya",India,"December 31, 2019",2014,TV-MA,131 min,"Comedies, Dramas, International Movies",A philandering small-town mechanic's political ambitions are sparked when the visiting prime minister mistakenly grants him special security clearance.
640,81024730,Movie,Life Ki Toh Lag Gayi,Rakesh Mehta,"Kay Kay Menon, Ranvir Shorey, Manu Rishi Chadha, Pradhuman Singh, Neha Bhasin, Jackie Shroff, Asrani, Neeraj Vora, Sharat Saxena, Tom Alter",India,"December 28, 2018",2012,TV-14,109 min,"Action & Adventure, Comedies, Dramas","A vengeful son, a cop on a mission, a wannabe actress and a jilted lover find their lives intermingling in unexpected ways over 24 hours in Mumbai."
641,81024717,Movie,Rehmataan,,"Sukhjinder Shera, Guggu Gill, Deep Dhillon, Raj Virk, Surinder Shinda",India,"December 28, 2018",2012,TV-14,116 min,"Dramas, International Movies, Romantic Movies","As unemployment, drug addiction and corruption plague a society, this drama depicts the people who believe there’s still good in the world."
642,80194558,TV Show,Selection Day,,"Mohammad Samad, Yash Shashank Dholye, Rajesh Tailang, Mahesh Manjrekar, Karanvir Malhotra, Ratna Pathak Shah, Akshay Oberoi",India,"December 28, 2018",2018,TV-14,1 Season,"International TV Shows, TV Dramas, Teen TV Shows",Two teen cricket prodigies struggle against their overbearing father and a system stacked against them to realize their own ambitions and identities.
643,80145086,Movie,When Hari Got Married,"Ritu Sarin, Tenzing Sonam",,"United Kingdom, India, United States","December 25, 2016",2013,NR,75 min,"Documentaries, International Movies","A small-town taxi driver is arranged to be married, resulting in an intimate look at the clash between modernity and tradition in India."
644,80229953,Movie,Madness in the Desert,Satyajit Bhatkal,"Aamir Khan, Ashutosh Gowariker",India,"December 22, 2017",2004,TV-PG,141 min,"Documentaries, International Movies","The story of making ""Lagaan,"" one of the millennium's seminal Indian films, is told from the point of view of production team member Satyajit Bhatkal."
645,80206847,Movie,Jab Harry Met Sejal,Imtiaz Ali,"Shah Rukh Khan, Anushka Sharma, Aru Krishansh Verma, Chandan Roy Sanyal, Evelyn Sharma, Kavi Shastri, Barbora Mudrochova, Paula Donner, Denis Dorokhov, Martavious Gayles",India,"December 2, 2017",2017,TV-14,142 min,"Comedies, International Movies, Romantic Movies",A philandering tour guide in Europe begins to develop feelings for one of his clients while helping her search for her lost engagement ring.
646,81018239,Movie,Ascharyachakit!,Samit Kakkad,"Priyanka Bose, Vaibhav Raj Gupta, Santosh Juvekar, Anangsha Biswas, Ankit Raaj, Kashmira Irani, Kailash Waghmare, Vipin Sharma",India,"December 19, 2018",2018,TV-MA,90 min,"Dramas, Independent Movies, International Movies","Entangling the lives of a movie star, a chauffeur, a prostitute and a pimp, this bold drama reveals ugly truths beneath Mumbai’s glitzy veneer."
647,81045765,Movie,Lilli,Prasobh Vijayan,"Samyuktha Menon, Aaryan Menon, Dhanesh Anand, Kannan Nayar, Sajin Cherukayil, Kevin Jose, Athulya",India,"December 17, 2018",2018,TV-MA,85 min,"Dramas, International Movies, Thrillers","A woman who's about to give birth finds her maternal instincts kicking in when she's abducted, imprisoned and brutalized by a vicious gang."
648,81039381,Movie,Andhadhun,Sriram Raghavan,"Tabu, Ayushmann Khurrana, Radhika Apte, Anil Dhawan, Manav Vij, Zakir Hussain, Ashwini Kalsekar, Chhaya Kadam, Pawan Singh, Kabir Sajid",India,"December 16, 2018",2018,TV-14,137 min,"Comedies, Dramas, International Movies",A visually impaired pianist’s world careens into a series of shocking twists after he unintentionally lands at the murder scene of a former film star.
649,80074933,Movie,Bangistan,Karan Anshuman,"Riteish Deshmukh, Pulkit Samrat, Kumud Mishra, Chandan Roy Sanyal, Arya Babbar, Shivkumar Subramaniam, Tom Alter, Jacqueline Fernandez",India,"December 15, 2019",2015,TV-14,134 min,"Comedies, Dramas, International Movies","Sent on the same deadly international mission by their rival religious factions, two men's madcap antics along the way take them hilariously off course."
650,60021525,Movie,Dil Chahta Hai,Farhan Akhtar,"Aamir Khan, Saif Ali Khan, Akshaye Khanna, Preity Zinta, Sonali Kulkarni, Dimple Kapadia, Ayub Khan, Rajat Kapoor, Suhasini Mulay, Ahmed Khan",India,"December 15, 2019",2001,TV-14,185 min,"Comedies, Dramas, International Movies","Inseparable childhood friends Akash, Sameer and Siddharth are just out of college. Nothing comes between them – until they each fall in love."
