index,show_id,type,title,director,cast,country,date_added,release_year,rating,duration,listed_in,description
0,81145628,Movie,Norm of the North: King Sized Adventure,"Richard Finn, Tim Maltby","Alan Marriott, Andrew Toth, Brian Dobson, Cole Howard, Jennifer Cameron, Jonathan Holmes, Lee Tockar, Lisa Durupt, Maya Kay, Michael Dobson","United States, India, South Korea, China","September 9, 2019",2019,TV-PG,90 min,"Children & Family Movies, Comedies","Before planning an awesome wedding for his grandfather, a polar bear king must take back a stolen artifact from an evil archaeologist first."
1,81154455,Movie,Article 15,Anubhav Sinha,"Ayushmann Khurrana, Nassar, Manoj Pahwa, Kumud Mishra, Isha Talwar, Sayani Gupta, Mohammed Zeeshan Ayyub, Subhrajyoti Barat, Sushil Pandey, Aakash Dabhade",India,"September 6, 2019",2019,TV-MA,125 min,"Dramas, International Movies, Thrillers",The grim realities of caste discrimination come to light as an entitled but upright city cop ventures into India’s heartland to investigate a murder.
2,81052275,Movie,Ee Nagaraniki Emaindi,Tharun Bhascker,"Vishwaksen Naidu, Sushanth Reddy, Abhinav Gomatam, Venkatesh Kakumanu, Anisha Ambrose, Simran Choudhary",India,"September 6, 2019",2018,TV-14,133 min,"Comedies, International Movies","In Goa and in desperate need of cash, four childhood friends get another shot at making their long-abandoned dreams of becoming filmmakers come true."
3,70303496,Movie,PK,Rajkumar Hirani,"Aamir Khan, Anuskha Sharma, Sanjay Dutt, Saurabh Shukla, Parikshat Sahni, Sushant Singh Rajput, Boman Irani, Rukhsar",India,"September 6, 2018",2014,TV-14,146 min,"Comedies, Dramas, International Movies",Aamir Khan teams with director Rajkumar Hirani to play a social crusader in a political satire on the state of corruption in India.
4,81155784,Movie,Watchman,A. L. Vijay,"G.V. Prakash Kumar, Samyuktha Hegde, Suman, Raj Arjun, Yogi Babu, Munishkanth",India,"September 4, 2019",2019,TV-14,93 min,"Comedies, Dramas, International Movies","Rushing to pay off a loan shark, a young man breaks into a bungalow to steal the cash, unprepared for the dog standing guard – or the trouble inside."
5,80225885,TV Show,Bard of Blood,,"Emraan Hashmi, Viineet Kumar, Sobhita Dhulipala, Jaideep Ahlawat, Kirti Kulhari, Sohum Shah, Rajit Kapoor, Danish Hussain",India,"September 27, 2019",2019,TV-MA,1 Season,"International TV Shows, TV Action & Adventure, TV Dramas","Years after a disastrous job in Balochistan, a former Indian spy must confront his past when he returns to lead an unsanctioned hostage-rescue mission."
6,81177238,Movie,Malaal,Mangesh Hadawale,"Meezaan Jaffrey, Sharmin Segal, Chinmaya Surve, Anil Gawas, Sonal Jha, Sanjay Gurbaxani, Sameer Dharmadhikari, Deepak Damle",India,"September 26, 2019",2019,TV-14,133 min,"International Movies, Romantic Movies","Class divides become thorns in the budding romance between the crony of a nativist Mumbai politician and the new, North Indian resident of his chawl."
7,81186758,Movie,Oh! Baby (Malayalam),B. V. Nandini Reddy,"Samantha Ruth Prabhu, Lakshmi, Rajendraprasad, Naga Shourya, Rao Ramesh, Teja Sajja, Pragathi, Jagapathi Babu, Aishwarya, Urvashi",India,"September 25, 2019",2019,TV-14,146 min,"Comedies, International Movies, Music & Musicals",A surly septuagenarian gets another chance at her 20s after having her photo snapped at a studio that magically takes 50 years off her life.
8,81186757,Movie,Oh! Baby (Tamil),B. V. Nandini Reddy,"Samantha Ruth Prabhu, Lakshmi, Rajendraprasad, Naga Shourya, Rao Ramesh, Teja Sajja, Pragathi, Jagapathi Babu, Aishwarya, Urvashi",India,"September 25, 2019",2019,TV-14,146 min,"Comedies, International Movies, Music & Musicals",A surly septuagenarian gets another chance at her 20s after having her photo snapped at a studio that magically takes 50 years off her life.
9,81176200,Movie,Manmadhudu 2,Rahul Ravindran,"Nagarjuna Akkineni, Rakul Preet Singh, Lakshmi, Rao Ramesh, Vennela Kishore, Jhansi, Devadarshini Chetan, Nishanti",India,"September 23, 2019",2019,TV-MA,152 min,"Comedies, Dramas, International Movies","Under pressure to marry, a perennial bachelor hires a much younger woman to act as his fiancée, but her bond with his family throws his plan for a loop."
10,81080769,Movie,Do Paise Ki Dhoop Chaar Aane Ki Baarish,Deepti Naval,"Manisha Koirala, Rajit Kapoor, Sanaj Naval, Rajendra Gupta, Suhaas Khandke, Nassar Abdulla, Saurabh Dubey, Usha Jadhav, Ashwin Kaushal, Milind Soman",India,"September 22, 2019",2009,TV-14,121 min,"Dramas, Independent Movies, International Movies","When a sex worker hires a gay songwriter to care for her disabled son, the ensuing bonds that form offer a complex portrayal of love and family."
11,81107545,Movie,Kabir Singh,Sandeep Reddy Vanga,"Shahid Kapoor, Kiara Advani, Suresh Oberoi, Arjan Bajwa, Adil Hussain, Nikita Dutta, Kamini Kaushal, Anurag Arora",India,"September 19, 2019",2019,TV-MA,171 min,"Dramas, International Movies, Romantic Movies","An exalted but short-fused surgeon plunges into a spiral of drugs, alcohol and rage after his intense relationship with his girlfriend turbulently ends."
12,81018233,Movie,Eeda,Ajithkumar,"Shane Nigaam, Nimisha Sajayan, Manikandan R. Achari, Alencier Ley Lopez, Sujith Sankar, P. Balachandran, Sudhi Koppa",India,"September 15, 2018",2018,TV-14,153 min,"Dramas, International Movies, Romantic Movies",Two young adults with families on opposite ends of the political spectrum fall in love in a Kerala city torn by violence.
13,81018234,Movie,​Goli Soda 2,Vijay Milton,"Samuthirakani, Bharath Seeni, Vinoth, Esakki Barath, Chemban Vinod Jose, Gautham Menon, Krisha Kurup, Subiksha",India,"September 15, 2018",2018,TV-MA,128 min,"Action & Adventure, Dramas, International Movies","A taxi driver, a gangster and an athlete struggle to better their lives despite obstacles like crooked politicians, evil dons and caste barriers."
14,81018235,Movie,​Maj Rati ​​Keteki,Santwana Bardoloi,"Adil Hussain, Shakil Imtiaz, Mahendra Rabha, Sulakshana Baruah, Rahul Gautam Sarma, Kulada Bhattacharjya, Indu Mohan Das, Moumita Talukdar",India,"September 15, 2018",2017,TV-14,117 min,"Dramas, International Movies","A successful writer returns to the town that launched his career, encountering people who spark nostalgic, often painfully illuminating flashbacks."
15,81018236,Movie,​Mayurakshi,Atanu Ghosh,"Soumitra Chatterjee, Prasenjit Chatterjee, Indrani Haldar, Sudipta Chakraborty, Suman Banerjee, Gargi Roychowdhury",India,"September 15, 2018",2017,TV-14,100 min,"Dramas, International Movies","When a middle-aged divorcee returns to Kolkata to visit his ailing father, long-buried memories resurface, bringing new discoveries with them."
16,81018237,Movie,Red Oleanders Raktokarobi,Amitava Bhattacharya,"Shantilal Mukherjee, Mumtaz Sorcar, Rahul, Koushik Sen, Rajesh Sharma, Debdut Ghosh, Anindya Banerjee, Amitabha Bhattacharjee, Usashi Chakraborty, Dipankar Dey",India,"September 15, 2018",2017,TV-14,112 min,"Dramas, International Movies","When a theater group stages a production of a Rabindranath Tagore play, they begin to notice parallels between the story and their own lives."
17,81018238,Movie,Samantaral,Partha Chakraborty,"Riddhi Sen, Parambrata Chatterjee, Soumitra Chatterjee, Aparajita Adhya, Tanusree Chakraborty, Kushal Chakraborty, Anindya Banerjee, Surangana Banerjee",India,"September 15, 2018",2017,TV-MA,110 min,"Dramas, International Movies","On a family visit, a young man and his girlfriend set out to discover why his eccentric uncle has been mysteriously confined to one room for years."
18,81093951,Movie,Oh! Baby,B. V. Nandini Reddy,"Samantha Ruth Prabhu, Lakshmi, Rajendraprasad, Naga Shourya, Rao Ramesh, Teja Sajja, Pragathi, Jagapathi Babu, Aishwarya, Urvashi",India,"September 14, 2019",2019,TV-14,157 min,"Comedies, International Movies, Music & Musicals",A surly septuagenarian gets another chance at her 20s after having her photo snapped at a studio that magically takes 50 years off her life.
19,80994130,Movie,Garbage,Qaushiq Mukherjee,"Tanmay Dhanania, Trimala Adhikari, Satarupa Das, Satchit Puranik, Gitanjali Dang, Shruti Viswan, Nikhil Chopra, Krish Moitra",India,"September 1, 2018",2018,TV-MA,109 min,"Dramas, Independent Movies, International Movies",The lives of a fundamentalist online troll and a woman reeling from a sex tape gone viral become dangerously intertwined in this provocative thriller.
20,81019924,Movie,Hope Aur Hum,Sudip Bandyopadhyay,"Naseeruddin Shah, Kabir Sajid, Sonali Kulkarni, Amir Bashir, Naveen Kasturia, Neha Chauhan, Virti Vaghani",India,"September 1, 2018",2018,TV-14,95 min,"Children & Family Movies, Comedies, Dramas","A multigenerational household navigates daily life, evolving relationships and clashes between old and new mindsets in this light family drama."
21,81018240,Movie,​​Kuch Bheege Alfaaz,Onir,"Geetanjali Thapa, Zain Khan Durrani, Shray Rai Tiwari, Mona Ambegaonkar, Chandreyee Ghosh, Barun Chanda, Saheb Bhattacharjee, Shefali Chauhan",India,"September 1, 2018",2018,TV-14,110 min,"Dramas, Independent Movies, International Movies","After accidentally connecting over the Internet, two strangers form a tight friendship – not knowing they already share a bond."
22,81013710,Movie,Love and Shukla,Jatla Siddartha,"Saharsh Kumar Shukla, Taneea Rajawat, Hima Singh, Aparna Upadhyay, Loknath Tiwari, Sambhaji Sasane",India,"September 1, 2018",2017,TV-MA,110 min,"Dramas, Independent Movies, International Movies","A sexually inexperienced rickshaw driver struggles to build intimacy with his shy new wife in their tiny, overcrowded quarters."
23,81014988,Movie,Once Again,Kanwal Sethi,"Shefali Shah, Neeraj Kabi, Rasika Dugal, Bidita Bag, Priyanshu Painyuli, Bhagwan Tiwari","India, Germany, Austria","September 1, 2018",2018,TV-PG,101 min,"Dramas, Independent Movies, International Movies","After a chance phone call leads to daily conversations, a widowed restaurant owner and a lonely film actor plan to finally meet in person."
24,20254278,Movie,Aakhri Adaalat,Rajiv Mehra,"Vinod Khanna, Dimple Kapadia, Jackie Shroff, Sonam, Vinod Mehra, Shafi Inamdar, Gulshan Grover, Roopesh Kumar",India,"September 1, 2017",1988,TV-14,148 min,"Action & Adventure, International Movies",An intrepid police inspector forced into a desk job must take matters into his own hands when ruthless criminals are released on a technicality.
25,80158389,Movie,Chadi Jawani Budhe Nu,,Anand,India,"September 1, 2017",1976,TV-PG,135 min,"Comedies, International Movies, Romantic Movies","After reaching his 40th birthday, an egotistical businessman kicks off his midlife crisis by deciding to secure a mistress."
26,80156941,Movie,Ek Jaan Hain Hum,Rajiv Mehra,"Rajiv Kapoor, Divya Rana, Shammi Kapoor, Tanuja, Kiran Vairale, Rakesh Bedi, Gulshan Grover, Monty Sharma",India,"September 1, 2017",1983,TV-14,151 min,"Dramas, International Movies, Music & Musicals","While trying to win over his beloved’s parents, a young man is accused of arson, and his father soon realizes insanity may be his only defense."
27,80158480,Movie,Khoon Khoon,Mohammed Hussain,"Danny Denzongpa, Mahendra Sandhu, Rekha, Faryal, Helen, Jagdeep",India,"September 1, 2017",1973,TV-14,132 min,"Action & Adventure, International Movies","As a crazed killer blazes a trail of blood through an anxious city, a hardened cop aims to take him down by any means in this remake of “Dirty Harry.”"
28,80205314,Movie,Lorai: Play to Live,Parambrata Chatterjee,"Prasenjit Chatterjee, Payel Sarkar, Indrasish Roy, Kanchan Mullick, Kharaj Mukherjee, Gargi Roychowdhury, Deepankar De, Biswajit Chakraborty, Bharat Kaul, Rajat Ganguly",India,"September 1, 2017",2015,TV-14,155 min,"Dramas, International Movies, Sports Movies","Under a government initiative, a retired alcoholic soccer player is sent to establish a soccer team in a politically troubled area."
29,80158545,Movie,Manoranjan,Shammi Kapoor,"Sanjeev Kumar, Zeenat Aman, Shammi Kapoor, Dev Kumar, Madan Puri, Paintal, Asit Kumar Sen, Agha, Murad, Shefali",India,"September 1, 2017",1974,TV-14,162 min,"Comedies, International Movies, Music & Musicals","After getting fired, a police officer connects with a prostitute he met on the job in a red-light district and sets out to keep her off the streets."
30,80156939,Movie,Mujrim,Umesh Mehra,"Mithun Chakraborty, Madhuri Dixit, Suresh Oberoi, Shakti Kapoor, Pallavi Joshi, Gulshan Grover, Amrish Puri, Nutan, Jagdeep, Sharat Saxena",India,"September 1, 2017",1989,TV-14,163 min,"Action & Adventure, Dramas, International Movies","Jailed as a teenager, Shankar has been unable to stay on the right side of the law ever since, despite his wife's pleas and his mother's rejection."
31,80157134,Movie,Sohni Mahiwal,"Latif Faiziyev, Umesh Mehra","Zeenat Aman, Pran, Tanuja, Poonam Dhillon","India, Soviet Union","September 1, 2017",1984,TV-PG,160 min,"Dramas, International Movies, Romantic Movies","After being violently separated from the woman he loves, a young man must disguise himself in order to keep meeting her."
32,80170301,Movie,Kung Fu Yoga,Stanley Tong,"Jackie Chan, Disha Patani, Amyra Dastur, Sonu Sood, Aarif Rahman, Miya Muqi, Zhang Yixing, Eric Tsang","China, India, Nepal","October 6, 2017",2017,TV-PG,107 min,"Action & Adventure, Comedies, International Movies",Two mismatched archaeologists battle a team of vicious mercenaries in a race to discover an ancient Tibetan treasure of unimaginable worth.
33,81177367,Movie,Noblemen,Vandana Kataria,"Ali Haji, Kunal Kapoor, Muskkaan Jaferi, Hardik Thakkar, Ali Mir, Shaan Grover, M.K. Raina, Ivan Rodrigues",India,"October 5, 2019",2019,TV-MA,109 min,"Dramas, Independent Movies, International Movies","When he lands the lead in his Christian school's production of ""The Merchant of Venice,"" a secretly gay student is bullied by wealthy upperclassmen."
34,81177371,Movie,Mehandi Circus,Saravana Rajendran,"Madhampatti Rangaraj, Shweta Tripathi, Vela Ramamoorthy, Ankur Vikal, G. Marimuthu, Sunny Charles",India,"October 30, 2019",2019,TV-14,126 min,"Dramas, International Movies, Romantic Movies","In the early 1990s, the love between a cassette shop owner and a traveling circus performer challenges caste barriers and disapproving parents."
35,70067230,Movie,My Brother ... Nikhil,Onir,"Juhi Chawla, Sanjay Suri, Victor Banerjee, Lillete Dubey, Purab Kohli, Dipannita Sharma, Gautam Kapoor",India,"October 30, 2018",2005,TV-PG,116 min,"Dramas, Independent Movies, International Movies","After being diagnosed HIV-positive, a champion swimmer is disowned and harassed by all except his loving sister and loyal boyfriend."
36,80207446,Movie,Shorgul,"Jitendra Tiwari, Pranav Singh","Ashutosh Rana, Jimmy Shergill, Suha Gezen, Sanjay Suri, Narendra Jha, Hiten Tejwani, Eijaz Khan, Aniruddha Dave",India,"October 30, 2018",2016,TV-14,122 min,"Dramas, International Movies",A Hindu boy's feelings for a Muslim girl expose the tensions between their two communities and open the door to chaos and violence.
37,80207447,Movie,Siddhant,Vivek Wagh,"Vikram Gokhale, Swati Chitnis, Kishore Kadam, Ganesh Yadav, Sarang Sathaye, Archit Deodhar, Madhavi Soman, Neha Mahajan",India,"October 30, 2018",2014,TV-G,105 min,"Dramas, Independent Movies, International Movies",A principled mathematics teacher is shocked to discover that his grandson used unethical means to achieve academic success.
38,80191963,Movie,The Black Prince,Kavi Raz,"Satinder Sartaaj, Shabana Azmi, Jason Flemyng, Amanda Root, Rup Magon, Sophie Stevens, Keith Duffy, David Essex, Leanne Joyce, Ranjit Singh Shubh","United Kingdom, India, United States","October 3, 2018",2017,PG-13,121 min,"Dramas, International Movies","After being exiled to England as a child, a Punjabi prince struggles to return to his homeland and his Sikh faith in this historical drama."
39,81025088,Movie,W/O Ram,Vijay Yelakanti,"Lakshmi Manchu, Aadarsh Balakrishna, Priyadarshi Pullikonda, Samrat Reddy, Shrikanth Iyyangar, Shrusti Dange",India,"October 26, 2018",2018,TV-MA,115 min,"Dramas, International Movies, Thrillers","Frustrated with the stalled investigation into her husband's murder, a woman searches for the killer on her own, putting herself in grave danger."
40,80205231,Movie,Baahubali: The Beginning (English Version),S.S. Rajamouli,"Prabhas, Rana Daggubati, Anushka Shetty, Tamannaah Bhatia, Sathyaraj, Nassar, Ramya Krishnan, Sudeep",India,"October 24, 2018",2015,TV-14,138 min,"Action & Adventure, Dramas, International Movies",Villagers in the kingdom of Mahismati rescue a baby who is destined to embark on a heroic quest in this English version of S.S. Rajamouli's epic.
41,70170182,Movie,Aashayein,Nagesh Kukunoor,"John Abraham, Sonal Sehgal, Prateeksha Lonkar, Girish Karnad, Farida Jalal, Ashwin Chitale, Anaitha Nair, Vikram Inamdar, Vipin Bhali, Poonam Chitale, Nagesh Kukunoor",India,"October 22, 2017",2010,TV-14,115 min,"Dramas, International Movies","When he learns he has terminal cancer, a cynical gambler and chronic smoker ditches his fiancée, snubs doctors and checks into a nursing home to die."
42,70082633,Movie,Bhool Bhulaiyaa,Priyadarshan,"Akshay Kumar, Vidya Balan, Ameesha Patel, Shiney Ahuja, Paresh Rawal, Rajpal Yadav, Manoj Joshi, Asrani, Vikram Gokhale, Rasika Joshi",India,"October 22, 2017",2007,TV-14,148 min,"Dramas, International Movies, Thrillers","Siddharth dismisses warnings that his palace might be haunted, until ghostly occurrences force him to reconsider his beliefs."
43,70049619,Movie,Humko Deewana Kar Gaye,Raj Kanwar,"Akshay Kumar, Katrina Kaif, Bipasha Basu, Bhagyashree, Shernaz Patel, Vivek Shaq, Mahesh Thakur, Ranjeet, Nina Kulkarni, Puneet Issar, Anju Mahendru, Manoj Joshi, Anil Kapoor",India,"October 22, 2017",2006,TV-PG,149 min,"International Movies, Music & Musicals, Romantic Movies",Two kindred spirits who are betrothed to others must decide whether to go through with arranged marriages or brush aside convention for true love.
44,80211135,Movie,Kajraare,Pooja Bhatt,"Himesh Reshammiya, Sara Loren, Amrita Singh, Gulshan Grover, Javed Sheikh, Adnan Shah, Natasha Sinha, Gaurav Chanana, Anupam Shyam",India,"October 22, 2017",2010,TV-14,113 min,"Dramas, International Movies, Music & Musicals","A popular singer on the run poses as a bartender and falls in love with a prostitute, but their love is threatened by a violent incident in his past."
45,70109884,Movie,Karzzzz,Satish Kaushik,"Himesh Reshammiya, Urmila Matondkar, Shweta Kumar, Dino Morea, Raj Babbar, Danny Denzongpa, Gulshan Grover, Rohini Hattangadi, Asrani, Smita Bansal",India,"October 22, 2017",2008,TV-14,137 min,"International Movies, Music & Musicals, Romantic Movies","When flashbacks reveal that he's the reincarnation of a man murdered by his wife, rock star Monty sets out to get revenge for the decades-old crime."
46,70176967,Movie,Patiala House,Nikhil Advani,"Rishi Kapoor, Dimple Kapadia, Akshay Kumar, Anushka Sharma, Tinnu Anand, Soni Razdan, Prem Chopra, Masood Akhtar, Jeneva Talwar, Suparna Marwah",India,"October 22, 2017",2011,TV-PG,140 min,"Dramas, International Movies, Sports Movies","A talented young Indian cricket player must defy his father's wishes to play for the side of England, a rebellion his siblings quietly cheer."
47,70198040,Movie,Ready,Anees Bazmee,"Salman Khan, Asin, Paresh Rawal, Mahesh Manjrekar, Anuradha Patel, Manoj Pahwa, Manoj Joshi, Puneet Issar, Sharat Saxena, Akhilendra Mishra, Zarine Khan, Arya Babbar",India,"October 22, 2017",2011,TV-PG,144 min,"Comedies, International Movies, Romantic Movies","Bollywood superstar Salman Khan plays Prem, an heir to a perfume fortune who falls in love with the wrong woman in this romantic comedy."
48,81011973,Movie,Naa Bangaaru Talli,Rajesh Touchriver,"Siddique, Anjali Patil, Lakshmi Menon, Nina Kurup, Rathna Shekar Reddy, Anoop Aravindan",India,"October 19, 2018",2013,TV-MA,122 min,"Dramas, International Movies","A father leading a dark double life and his daughter, who's eager to pursue her studies in Hyderabad, face the tragic consequences of sex trafficking."
49,81020066,TV Show,Mighty Little Bheem: Diwali,,"Samriddhi Shukla, Nishka Raheja, Arannya Kaur, Shanoor Mirza, Rajesh Kava",India,"October 18, 2019",2019,TV-Y,1 Season,"Kids' TV, TV Comedies","From decorating his home to devouring sweets, join Bheem as he makes merry – and a bit of mischief – while the festival of lights is in full swing."
50,80998890,Movie,Upstarts,Udai Singh Pawar,"Priyanshu Painyuli, Chandrachoor Rai, Shadab Kamal, Rajeev Siddhartha, Sheetal Thakur, Ninad Kamat, Swati Semwal, Eijaz Khan",India,"October 18, 2019",2019,TV-14,112 min,"Comedies, Dramas, International Movies","Hoping to do good while making millions, three college graduates create a startup. But as business begins to flourish, their own bond starts to fray."
51,81026343,Movie,Mr. Chandramouli,Thiru,"Karthik, Gautam Karthik, Regina Cassandra, Varalakshmi Sarathkumar, Santhosh Prathap, Mime Gopi, J. Mahendran, Viji Chandrasekhar",India,"October 18, 2018",2018,TV-MA,131 min,"Dramas, International Movies, Thrillers","When the lives of a carefree boxer and his cabdriver dad collide with the ambitions of a ruthless businessman, a search for answers turns to revenge."
52,80211134,Movie,Baadshaho,Milan Luthria,"Ajay Devgn, Emraan Hashmi, Vidyut Jamwal, Ileana D'Cruz, Esha Gupta, Sanjay Mishra, Sunny Leone, Sharad Kelkar, Priyanshu Chatterjee, Denzil Smith",India,"October 16, 2017",2017,TV-14,135 min,"Action & Adventure, International Movies","In 1975, during the government-declared Emergency, thief Bhawani and his crew plan a daring robbery to reclaim his royal lover's seized treasures."
53,80204433,Movie,Lucknow Central,Ranjit Tiwari,"Farhan Akhtar, Diana Penty, Ronit Roy, Gippy Grewal, Deepak Dobriyal, Inaamulhaq, Rajesh Sharma",India,"October 16, 2017",2017,TV-14,144 min,"Dramas, International Movies, Music & Musicals","After being arrested for a crime he didn't commit, an aspiring musician teams up with some of his inmates at Lucknow Central to form a band."
54,81006356,TV Show,Devlok with Devdutt Pattanaik,,"Rasika Dugal, Devdutt Pattanaik",India,"October 15, 2018",2017,TV-PG,1 Season,International TV Shows,"Through chats with host Rasika Dugal, mythologist Devdutt Pattanaik explores the meaning and modern-day relevance of Indian folklore and philosophy."
55,81025935,Movie,Meghnadbodh Rohoshyo,Anik Datta,"Barun Chanda, Sabyasachi Chakraborty",India,"October 15, 2018",2017,TV-14,150 min,"Dramas, International Movies","A professor mysteriously vanishes, leaving behind a host of suspects, a shadowy history and a clue: the anonymous birthday gift of a Bengali classic."
56,81020508,Movie,Sanju,Rajkumar Hirani,"Ranbir Kapoor, Vicky Kaushal, Paresh Rawal, Sonam Kapoor, Dia Mirza, Jim Sarbh, Anushka Sharma, Manisha Koirala, Boman Irani",India,"October 15, 2018",2018,TV-MA,159 min,"Dramas, International Movies","From the depths of addiction to the heights of stardom to underworld entanglements, this biopic traces the checkered past of Indian actor Sanjay Dutt."
57,80201824,Movie,A Scandall,Ishaan Trivedi,"Johnny Baweja, Reeth Mazumder, Manav Kaul, Tanvi Vyas, Puru Chibber, Vasundhara Kaul, Aayam Mehta, Niraj Sah",India,"October 15, 2017",2016,TV-MA,108 min,"International Movies, Thrillers","A film school graduate is interested in making a movie about his girlfriend's uncle, who claims that he can see his long-dead daughter."
58,80203782,Movie,Aisa Yeh Jahaan,Biswajeet Bora,"Palash Sen, Ira Dubey, Yashpal Sharma, Tinnu Anand, Prisha Dabbas, Kymsleen Kholie, Satish Sharma",India,"October 15, 2017",2015,TV-14,127 min,"Dramas, Independent Movies, International Movies","During a vacation with her parents, away from her concrete urban existence, a young girl learns to appreciate the joys of connecting with nature."
59,80201829,Movie,Ankur Arora Murder Case,Sohail Tatari,"Kay Kay Menon, Tisca Chopra, Arjun Mathur, Paoli Dam, Vishakha Singh, Manish Chaudhary, Vishesh Tiwari, Harsh Chhaya",India,"October 15, 2017",2013,TV-14,127 min,"Dramas, International Movies, Thrillers",A young medical intern sets out to fight for justice after the negligence of the surgeon he looked up to ends in tragedy.
60,80202089,Movie,Calendar Girls,Madhur Bhandarkar,"Akanksha Puri, Avani Modi, Kyra Dutt, Ruhi Singh, Satarupa Pyne, Mita Vashisht, Keith Sequeira, Deepak Wadhwa, Indraneil Sengupta, Vikram Sakhalkar",India,"October 15, 2017",2015,TV-14,126 min,"Dramas, International Movies",Five calendar models try to navigate the twists and turns thrown in their path by the seductive and ruthless world of glamour.
61,80203789,Movie,Darra,Parveen Kumar,"Gurpreet Ghuggi, Happy Raikoti, Kartar Cheema, Sardar Sohi, Shavendra Mahal, Karamjit Anmol, Pammi Bai, Nirmal Rishi, Manpreet Saggu",India,"October 15, 2017",2016,TV-14,121 min,"Dramas, International Movies","After returning from school and getting married, a popular farmer begins to arouse resentment and jealousy among those around him."
62,80201825,Movie,Gour Hari Dastaan: The Freedom File,Ananth Narayan Mahadevan,"Vinay Pathak, Konkona Sen Sharma, Ranvir Shorey, Tannishtha Chatterjee, Rajit Kapoor, Vikram Gokhale, Vipin Sharma, Rahul Vohra, Saurabh Shukla, Asrani",India,"October 15, 2017",2015,TV-14,109 min,"Dramas, Independent Movies, International Movies",A former freedom fighter is forced to navigate the corridors of a disinterested bureaucracy to prove that he fought in India's freedom movement.
63,80028360,Movie,Jal,Girish Malik,"Purab Kohli, Tannishtha Chatterjee, Kirti Kulhari, Yashpal Sharma, Mukul Dev, Saidah Jules, Ravi Gossain, Rahul Singh",India,"October 15, 2017",2013,TV-14,132 min,"Dramas, Independent Movies, International Movies",A gifted young man from a drought-stricken village helps a group of ecologists find water for migrating flamingoes.
