index,show_id,type,title,director,cast,country,date_added,release_year,rating,duration,listed_in,description
196,70108590,Movie,Welcome to Sajjanpur,Shyam Benegal,"Shreyas Talpade, Amrita Rao, Ravi Kishan, Ila Arun, Rajeshwari Sachdev, Divya Dutta, Yashpal Sharma, Ravi Jhankal, Lalit Mohan Tiwari",India,"November 1, 2018",2008,TV-PG,131 min,"Comedies, Dramas, International Movies","An educated man assists the illiterate residents of his village with written correspondence, sometimes manipulating the letters to suit his interests."
197,81024728,Movie,Yeh Hai Bakrapur,,"Amit Sial, Yoshika Verma, Anshuman Jha, Asif Basra, Suruchi Aulakh",India,"November 1, 2018",2014,TV-14,95 min,"Comedies, Dramas, Independent Movies","A poor family’s goat suddenly acquires divine status, sparking a widespread frenzy as everyone clamors to benefit from its unexpected celebrity."
198,70185141,Movie,Zokkomon,Satyajit Bhatkal,"Darsheel Safary, Anupam Kher, Manjari Fadnis, Tinnu Anand, Sheeba Chaddha, S.M. Zaheer, Aayam Mehta, Gargi Datar, Jai Vyas",India,"November 1, 2018",2011,PG,104 min,"Children & Family Movies, Dramas","When his cruel uncle abandons him, a young orphan learns to access the untapped superpowers that have been waiting within him all along."
199,80201826,Movie,6-5=2,Bharat Jain,"Prashantt Guptha, Gaurav Paswala, Gaurav Kothari, Disha Kapoor, Niharica Raizada, Ashrut Jain, Darshan Machamada",India,"November 1, 2017",2014,TV-MA,103 min,"Horror Movies, International Movies, Thrillers","Six friends decide to undertake a grueling mountain trek, only to find that the difficulties in store for them are not merely physical."
200,80158388,Movie,Bandie,Alo Sarkar,"Uttam Kumar, Sulakshana Pandit, Utpal Dutt, Bindu, Amjad Khan, Helen, Indrani Mukherjee, Padma Khanna, Iftekhar",India,"November 1, 2017",1978,TV-14,141 min,"Action & Adventure, Dramas, International Movies","Heirless Maharaj Brajbhan leaves his throne to his cousin Vikram, but when Brajbhan's wife, Badi Rani, finally conceives, Vikram plots to destroy her."
201,80203778,Movie,Beiimaan Love,Rajeev Chaudhari,"Sunny Leone, Rajneesh Duggal, Rajeev Verma, Daniel Weber, Yuvraj Siddharth Singh, Ziesha Nancy",India,"November 1, 2017",2016,TV-MA,115 min,"Dramas, International Movies, Romantic Movies","After having her heart broken by a man who seduced her at a party, a young, ambitious woman concocts a scheme to get revenge."
202,80201820,Movie,Coffee with D,Vishal Mishra,"Sunil Grover, Zakir Hussain, Anjana Sukhani, Dipannita Sharma, Pankaj Tripathi, Rajesh Sharma, Vinod Ramani, Guru Singh",India,"November 1, 2017",2017,TV-PG,120 min,"Comedies, Independent Movies, International Movies",Low TV ratings drive a well-known journalist to concoct a plan to interview a notorious underworld figure who is also a suspected terrorist.
203,80203791,Movie,Kacche Dhaagey,Buta Singh,"Yograj Singh, Nitu Pandher, Deep Mandian, Shreya Chawla, Jagpal Singh Chahal, Jyoti Sharma, Janak Joshi, Karan Vinayak",India,"November 1, 2017",2016,TV-14,120 min,"Dramas, International Movies, Romantic Movies","While visiting India for her cousin's wedding, a Canadian girl develops strong feelings for a boy from a lower caste."
204,80079229,Movie,Kis Kisko Pyaar Karoon,"Abbas Alibhai Burmawalla, Mastan Alibhai Burmawalla","Kapil Sharma, Arbaaz Khan, Varun Sharma, Sharat Saxena, Supriya Pathak, Manoj Joshi, Manjari Fadnis, Simran Kaur Mundi, Elli Avram, Jamie Lever",India,"November 1, 2017",2015,TV-PG,132 min,"Comedies, International Movies","A man's decision to marry three women, to keep them from committing suicide, complicates his relationship with his girlfriend."
205,80216270,Movie,One Heart: The A.R. Rahman Concert Film,,A.R. Rahman,India,"November 1, 2017",2017,TV-G,87 min,"Documentaries, International Movies, Music & Musicals","In this concert film, Indian musical maestro A.R. Rahman performs 15 of his most popular songs and reveals himself through interviews and clips."
206,80032364,Movie,Punjab 1984,Anurag Singh,"Diljit Dosanjh, Kiron Kher, Sonam Bajwa, Pavan Malhotra, Rana Ranbir, Vishwas Kini, Manav Vij, Vansh Bhardwaj","Canada, India","November 1, 2017",2014,TV-14,158 min,"Dramas, International Movies","During a time of political turmoil, a mother goes on a journey in search of her missing son, who has been misjudged and labeled a terrorist."
207,80203786,Movie,Rivaaz,Ashok Nanda,"Deepti Naval, Vijay Raaz, Meghna Naidu, Saadhika Randhawa, Ritisha Vijayvargya, Manoj Biddvai, Sayaji Shinde, Reema Lagoo",India,"November 1, 2017",2011,TV-MA,107 min,"Dramas, Independent Movies, International Movies","In a village where girls are auctioned off rather than married, a man falls in love with a girl who is about to face the bidders."
208,80032097,Movie,Romeo Ranjha,Navaniat Singh,"Jazzy B, Garry Sandhu, Monica Bedi, Parul Gulati, Rana Ranbir, Yograj Singh, Rana Jung Bahadur, Sanga Jagir","India, Canada","November 1, 2017",2014,TV-14,122 min,"Action & Adventure, Comedies, Music & Musicals","Two common boys travel from India to Thailand to find success and money, enjoying their friendship and finding ways to cheat the cheats."
209,80201827,Movie,Trip to Bhangarh: Asia's Most Haunted Place,Jitender Pawar,"Manish Chaudhary, Suzanna Mukherjee, Piyush Raina, Rachit Behl, Rohit Chaudhury, Vikram Kochhar, Poonam Pandey",India,"November 1, 2017",2014,TV-MA,113 min,"International Movies, Thrillers","To amuse themselves, six college friends decide to pay a visit to a fortress believed by some to be the most haunted place in Asia."
210,80203780,Movie,Waarrior Savitri,Param Gill,"Niharica Raizada, Rajat Barmecha, Lucy Pinder, Om Puri, Gulshan Grover, Tim Man, Ron Smoorenburg, KaramVeer Chaudhary",India,"November 1, 2017",2016,TV-14,120 min,"Action & Adventure, International Movies, Sci-Fi & Fantasy","In a modern adaptation of a mythological tale, a devoted wife is willing to do whatever it takes to rescue her husband from the clutches of death."
211,80211371,Movie,Yaara O Dildaara,Ksshitij Chaudhary,"Harbhajan Mann, Tulip Joshi, Kabir Bedi, Gulzar Chahal, Jonita, Gurpreet Ghuggi, Gurpreet Grewal, Neena Cheema, Sunita Dhir",India,"November 1, 2017",2011,TV-14,132 min,"Dramas, International Movies, Music & Musicals",The patriarch of a wealthy family with one industrious son and one who's a playboy arranges for the marriage of one to the woman the other loves.
212,70172928,Movie,War Horse,Steven Spielberg,"Emily Watson, David Thewlis, Peter Mullan, Niels Arestrup, Tom Hiddleston, Jeremy Irvine, Benedict Cumberbatch, Toby Kebbell, David Kross, Eddie Marsan, Nicolas Bro, Rainer Bock, Patrick Kennedy, Liam Cunningham","United States, India","May 6, 2019",2011,PG-13,147 min,Dramas,"During World War I, the bond between a young Englishman and his loyal horse, Joey, is tested when Joey is sold to the cavalry and sent to France."
213,70109249,Movie,C Kkompany,Sachin Yardi,"Mahesh Bhatt, Mithun Chakraborty, G.K. Desai, Celina Jaitly, Karan Johar, Ekta Kapoor, Tusshar Kapoor, Anupam Kher, Ashok Pandit, Lalit Parashar, Raima Sen, Rajpal Yadav",India,"May 31, 2019",2008,TV-14,127 min,"Action & Adventure, Comedies, International Movies","To blow off some steam, friends Akshay, Joshi and Lambodar, posing as a gang called C Kkompany, make a phony extortion demand to Joshi's apathetic son. The trio is shocked when their prank call makes them anonymous celebrities."
214,80993095,Movie,Chopsticks,Sachin Yardi,"Abhay Deol, Mithila Palkar, Vijay Raaz",India,"May 31, 2019",2019,TV-MA,101 min,"Comedies, Dramas, Independent Movies",A gifted but insecure woman embarks on a transformative journey when she enlists an enigmatic con man to recover her stolen car from an eccentric thug.
215,70045644,Movie,Koi Aap Sa,Partho Mitra,"Aftab Shivdasani, Natassha, Dipannita Sharma, Himanshu Mallik, Vaidya Advai, Pushy Anand, Shama Deshpande, Rajendra Gupta",India,"May 31, 2019",2006,TV-14,135 min,"Comedies, International Movies, Music & Musicals","Star athlete Rohan has his eye on a beautiful art student. But when his best friend Simran experiences a crisis, he drops everything to help her."
216,70025612,Movie,Krishna Cottage,Santram Varma,"Sohail Khan, Isha Koppikar, Natasha, Rati Agnihotri",India,"May 31, 2019",2004,TV-MA,124 min,"Action & Adventure, Horror Movies, International Movies",True love is put to the test when another woman comes between a pair of star-crossed young lovers in this thriller.
217,80237006,Movie,Mere Pyare Prime Minister,Rakeysh Omprakash Mehra,"Anjali Patil, Om Kanojiya, Niteesh Wadhwa, Makrand Deshpande, Syna Anand, Prasad, Adarsh, Rasika Agashe",India,"May 31, 2019",2019,TV-MA,103 min,"Dramas, International Movies","When his mother suffers a traumatic incident, a boy from the Mumbai slums treks to Delhi to deliver his written plea for justice to the Prime Minister."
218,80083930,Movie,Ragini MMS,Pawan Kripalani,"Kainaz Motivala, Rajkummar Rao, Rajat Kaul, Janice, Shernaza, Mangala Ahire, Vinod Rawat",India,"May 31, 2019",2011,TV-MA,93 min,"Horror Movies, International Movies",A couple out to have a sensuous weekend at a house outside of Mumbai finds it rigged with surveillance cameras and occupied by an evil entity.
219,80083752,Movie,Ragini MMS 2,Bhushan Patel,"Sunny Leone, Saahil Prem, Parvin Dabas, Sandhya Mridul, Divya Dutta, Soniya Mehra, Kainaz Motivala, Karan Mehra",India,"May 31, 2019",2014,TV-MA,113 min,"Horror Movies, International Movies",The horror continues when Ragini's video goes viral and a sleazy director decides to make a movie about the incident in the original house.
220,70185023,Movie,Shor In the City,"Raj Nidimoru, Krishna D.K.","Sendhil Ramamurthy, Tusshar Kapoor, Nikhil Dwivedi, Preeti Desai, Sundeep Kishan, Radhika Apte, Pitobash, Girija Oak, Alok Chaturvedi, Sudhir Chowdhary",India,"May 31, 2019",2011,TV-MA,106 min,"Comedies, Dramas, Independent Movies","When three small-time Mumbai crooks steal a bag on a train, they find that it's filled with weapons and realize that their lives may be in danger."
221,80176342,Movie,Rangoon,Vishal Bhardwaj,"Saif Ali Khan, Shahid Kapoor, Kangana Ranaut, Shriswara, Richard McCabe, Satoru Kawaguchi, Surendra Pal, Lin Laishram",India,"May 29, 2017",2017,TV-14,153 min,"Action & Adventure, Dramas, International Movies","During World War II, daredevil star Miss Julia entertains soldiers at the Indo-Burma border, where she's caught up in a web of love and deceit."
222,80164778,Movie,Raees,Rahul Dholakia,"Shah Rukh Khan, Mahira Khan, Nawazuddin Siddiqui, Mohammed Zeeshan Ayyub, Sheeba Chaddha, Shubham Chintamani, Shubham Tukaram, Atul Kulkarni, Narendra Jha, Jaideep Ahlawat, Sunny Leone",India,"May 26, 2017",2017,NR,143 min,"Action & Adventure, Dramas, International Movies","After street smart kid Raees rises to become Gujarat's bootlegging king in the 1980s, he tries to balance his life of crime with helping his people."
223,81132060,TV Show,Thackeray,,,India,"May 25, 2019",2019,TV-MA,1 Season,TV Shows,"From controversial cartoonist to powerful Mumbai politician, this biopic maps the meteoric rise of far-right Shiv Sena party founder, Bal Thackeray."
224,80084666,Movie,Colours of Passion,Ketan Mehta,"Randeep Hooda, Nandana Sen, Jim Boeven, Paresh Rawal, Tom Alter, Vikram Gokhale, Vipin Sharma, Gaurav Dwivedi",India,"May 25, 2018",2008,TV-14,114 min,"Dramas, International Movies","Seeking inspiration, a young 19th-century painter finds a woman who is his love, his muse and his willing subject, but his work becomes controversial."
225,81057229,Movie,The Man Who Feels No Pain,Vasan Bala,"Abhimanyu Dassani, Radhika Madan, Gulshan Devaiah, Mahesh Manjrekar, Jimit Trivedi, Loveleen Mishra, Sartaaj Kakkar, Riva Arora",India,"May 22, 2019",2018,TV-MA,137 min,"Action & Adventure, Comedies, International Movies","Leveraging his ability to withstand pain, a young man trains to follow in the footsteps of his martial-arts hero in this high-action, meta comedy."
226,81005364,Movie,Zero,Aanand Rai,"Shah Rukh Khan, Anushka Sharma, Katrina Kaif, Mohammed Zeeshan Ayyub, Tigmanshu Dhulia, Sheeba Chaddha, Brijendra Kala, Mallika Dua, Abhay Deol, Madhavan",India,"May 21, 2019",2018,TV-14,159 min,"Comedies, Dramas, International Movies","Through his relationships with two wildly different women, a vertically challenged bachelor with a larger-than-life persona must discover his purpose."
227,81096151,Movie,Laatu,Manav Shah,"Gagan Kokri, Aditi Sharma, Karamjit Anmol, Sardar Sohi, Anita Devgan, Ashish Duggal, Nisha Bano, Harby Sangha, Rahul Jungral, Prakash Gadhu",India,"May 2, 2019",2018,TV-Y7,116 min,"Comedies, Dramas, International Movies",A man who hopes to bring light to his village must compete with an officer from the electricity department to win over the love of his life.
228,80091267,Movie,Jalpari: The Desert Mermaid,Nila Madhab Panda,"Lehar Khan, Krishang Trivedi, Parvin Dabas, Suhasini Mulay, V.M. Badola, Tannishtha Chatterjee, Rahul Singh, Harsh Mayar",India,"May 19, 2018",2012,TV-14,94 min,"Dramas, Independent Movies, International Movies","When they travel to their father's ancestral village, city kids expecting a natural paradise instead find a poor, dusty town that harbors secrets."
229,81038047,Movie,Jonaki,Aditya Vikram Sengupta,"Lolita Chatterjee, Sumanto Chattopadhyay, Ratnabali Bhattacharjee, Jim Sarbh, Indrajit Sinha, Sandershika Tamang, Arunima Sinha, Satya Priya Chakraborty, Christel Das, Burjor Patel",India,"May 16, 2019",2018,TV-14,96 min,"Dramas, Independent Movies, International Movies","In this quiet, wistful drama, a woman on her deathbed searches her fraying memories for love and fulfillment through surreal, meditative tableaux."
230,60021906,Movie,Kyo Kii... Main Jhuth Nahin Bolta,David Dhawan,"Govinda, Mohnish Bahl, Sharad Kapoor, Satish Kaushik, Anupam Kher, Kiran Kumar, Rambha, Sushmita Sen",India,"May 16, 2019",2001,TV-PG,150 min,"Comedies, International Movies, Sci-Fi & Fantasy",The life and career of a lawyer are thrown into chaos when his son's wish magically renders him incapable of telling a lie.
231,70149579,Movie,"LSD: Love, Sex Aur Dhokha",Dibakar Banerjee,"Anshuman Jha, Rajkummar Rao, Amit Sial, Arya Banerjee, Neha Chauhan, Atul Mongia, Shruti, Herry Tangdi",India,"May 16, 2019",2010,TV-MA,112 min,"Dramas, Independent Movies, International Movies",This provocative drama examines how the voyeuristic nature of modern society affects three unusual couples in Northern India.
232,70109375,Movie,Mission Istaanbul: Darr Ke Aagey Jeet Hai,Apoorva Lakhia,"Vivek Oberoi, Zayed Khan, Shriya Saran, Nikitin Dheer, Shabbir Ahluwalia, Sunil Shetty, Shweta Bhardwaj",India,"May 16, 2019",2008,TV-MA,119 min,"Action & Adventure, International Movies, Music & Musicals",A television journalist makes a risky career move by accepting a job offer from a controversial Istanbul television station.
233,70289558,Movie,Once Upon a Time in Mumbai Dobaara!,Milan Luthria,"Akshay Kumar, Imran Khan, Sonakshi Sinha, Sonali Bendre, Sarfaraz Khan, Mahesh Manjrekar, Abhimanyu Singh, Kurush Deboo, Pitobash, Chetan Hansraj",India,"May 16, 2019",2013,TV-14,142 min,"Dramas, International Movies, Music & Musicals","This turbulent sequel to Once Upon a Time in Mumbai carries on the saga of the gangland don Shoaib Khan, who continues pressing for more control."
234,70158421,Movie,Action Replayy,Vipul Amrutlal Shah,"Akshay Kumar, Aishwarya Rai Bachchan, Om Puri, Kiron Kher, Neha Dhupia, Rannvijay Singh, Aditya Roy Kapoor, Randhir Kapoor, Sudeepa Singh, Alok Kumar, Rajpal Yadav",India,"May 16, 2018",2010,TV-PG,129 min,"Children & Family Movies, Comedies, International Movies","Vipul Amrutlal Shah directs this sci-fi rom-com that stars Akshay Kumar and Aishwarya Rai as Kishen and Mala, a married couple who are so miserable, they inspire their son, Bunty, to go back in time and make his parents fall in love."
235,20258084,Movie,Andaz Apna Apna,Rajkumar Santoshi,"Aamir Khan, Salman Khan, Raveena Tandon, Karisma Kapoor, Paresh Rawal, Viju Khote, Shehzad Khan, Deven Verma, Jagdeep, Mehmood",India,"May 16, 2018",1994,TV-PG,160 min,"Comedies, Cult Movies, International Movies","Broke and with no concrete plans for the future, two young men discover that a stunning heiress lives nearby and try to charm her into marriage."
236,70111279,Movie,EMI: Liya Hai To Chukana Padega,Saurabh Kabra,"Sanjay Dutt, Arjun Rampal, Malaika Arora, Aashish Chaudhary, Neha Uberoi, Urmila Matondkar, Manoj Joshi, Daya Shanker Pandey, Pushkar Jog, Kulbhushan Kharbanda",India,"May 15, 2019",2008,TV-14,128 min,"Comedies, Dramas, International Movies",A bank hires an enigmatic and unorthodox debt collector to recover money from four borrowers who are unable to pay their loans.
237,81123050,Movie,Hamid,Aijaz Khan,"Talha Arshad Reshi, Rasika Dugal, Vikas Kumar, Sumit Kaul, Bashir Lone, Gurveer Singh, Ashraf Nagoo, Mir Sarvar",India,"May 15, 2019",2018,TV-14,108 min,"Dramas, Independent Movies, International Movies","Wanting his missing father to come home, a Kashmiri boy repeatedly attempts to call God for help – until one day, a hardened army officer picks up."
238,70007056,Movie,Kucch To Hai,Anil V. Kumar,"Tusshar Kapoor, Esha Deol, Natasha, Jeetendra, Rishi Kapoor",India,"May 15, 2019",2003,TV-14,136 min,"Dramas, International Movies, Thrillers","A student tries to steal a test from a teacher's home, leaving him for dead after an accident. A string of murders may be the professor's revenge."
239,70035357,Movie,Kyaa Kool Hai Hum,Sangeeth Sivan,"Tusshar Kapoor, Riteish Deshmukh, Isha Koppikar, Neha Dhupia, Anupam Kher, Jay Sean",India,"May 15, 2019",2005,TV-14,165 min,"Comedies, International Movies, Music & Musicals","Longtime friends Rahul and Karan head to Mumbai intent on making their dreams come true, but both men are suddenly saddled with bad luck."
240,80108481,Movie,Kyaa Kool Hain Hum 3,Umesh Ghadge,"Tusshar Kapoor, Aftab Shivdasani, Krishna Abhishek, Mandana Karimi, Shakti Kapoor, Darshan Jariwala, Sushmita Mukherjee, Meghna Naidu, Anand Kumar, Claudia Ciesla",India,"May 15, 2019",2016,R,124 min,"Comedies, International Movies","When an unlikely porn actor falls for a woman outside the industry, he employs his co-stars as a stand-in traditional family to impress her father."
241,70153178,Movie,Once Upon a Time in Mumbaai,Milan Luthria,"Ajay Devgn, Emraan Hashmi, Kangana Ranaut, Prachi Desai, Randeep Hooda, Imran Hasnee, Dhiru Dwivedi",India,"May 15, 2019",2010,NR,133 min,"Dramas, International Movies, Music & Musicals","Mumbai's top mob boss rules the underworld with honor and compassion, but his power-hungry protégé will shake up the world of organized crime."
242,70073018,Movie,Shootout at Lokhandwala,Apoorva Lakhia,"Sanjay Dutt, Sunil Shetty, Amitabh Bachchan, Arbaaz Khan, Abhishek Bachchan, Diya Mirza, Aarti Chhabria, Tusshar Kapoor, Vivek Oberoi, Neha Dhupia, Rohit Roy, Aditya Lakhia, Ravi Gossain, Shabbir Ahluwalia, Akhilendra Mishra, Amrita Singh",India,"May 15, 2019",2007,UR,116 min,"Action & Adventure, Dramas, International Movies","Based on a true story, this action film follows an incident that stunned a nation in the early 1990s. In Mumbai, India, the notorious gangster Maya holds off veteran cop Khan and a force of more than 200 policemen in a six-hour bloody gunfight."
243,80994416,Movie,Aadu 2,Midhun Manuel Thomas,"Jayasurya, Vinayakan, Sunny Wayne, Vijay Babu, Saiju Kurup, Vineeth Mohan, Unni Rajan P. Dev, Dharmajan Bolgatty, Indrans",India,"May 15, 2018",2017,TV-14,150 min,"Comedies, International Movies","When Shaji Pappan and his gang of goofy outlaws find themselves low on funds, they plan to once again win a hefty prize in a tug-of-war competition."
244,80243408,Movie,Aiyaary,Neeraj Pandey,"Sidharth Malhotra, Manoj Bajpayee, Rakul Preet Singh, Pooja Chopra, Adil Hussain, Kumud Mishra, Naseeruddin Shah, Anupam Kher, Vikram Gokhale, Juhi Babbar",India,"May 15, 2018",2018,TV-14,158 min,"Action & Adventure, Dramas, International Movies","When his protégé goes rogue and poses a grave threat to the government he serves, a veteran officer of the Indian Army tries to stop him at all costs."
245,80157133,Movie,Chamatkar,Rajiv Mehra,"Shah Rukh Khan, Naseeruddin Shah, Urmila Matondkar, Malvika Tiwari, Shammi Kapoor, Deven Verma, Tinnu Anand, Anjana Mumtaz, Anjan Srivastav, Rakesh Bedi",India,"May 15, 2017",1992,TV-14,164 min,"Comedies, International Movies, Sci-Fi & Fantasy","A village schoolteacher and the ghost of a murdered man, who were both betrayed by those closest to them, join forces to help each other."
246,80122237,TV Show,Classic Legends,,Javed Akhtar,India,"May 15, 2017",2012,TV-PG,1 Season,"Docuseries, International TV Shows",This documentary series explores the glamour of Bollywood through the stories of the men and women who have illuminated its screens.
247,80157083,Movie,Kabhi Haan Kabhi Naa,Kundan Shah,"Shah Rukh Khan, Suchitra Krishnamoorthi, Deepak Tijori, Rita Bhaduri, Satish Shah, Anjan Srivastav, Goga Kapoor, Tiku Talsania, Ravi Baswani, Naseeruddin Shah",India,"May 15, 2017",1994,TV-14,151 min,"Comedies, Dramas, International Movies",A dreamer falls for a girl who is in love with someone else and tries to create a rift between her and the man she loves.
248,24081514,Movie,Ram Jaane,Rajiv Mehra,"Shah Rukh Khan, Juhi Chawla, Vivek Mushran, Pankaj Kapur, Puneet Issar, Tinnu Anand, Deven Verma, Gulshan Grover, Amrit Pal, Arun Bali",India,"May 15, 2017",1995,TV-14,142 min,"Dramas, International Movies, Music & Musicals","Two boyhood pals – one righteous, the other a criminal – take very different paths to adulthood. Their love for the same woman may prove disastrous."
249,81065331,Movie,Norm of the North: Keys to the Kingdom,Tim Maltby,"Andrew Toth, Cole Howard, Maya Kay, Jennifer Cameron, Alan Marriott, Lee Tockar, Brian Drummond","India, United States","May 13, 2019",2019,TV-PG,92 min,Children & Family Movies,"When Norm the polar bear is framed for a crime he didn’t commit, his friends step up to help him clear his name."
250,70287630,TV Show,The Jungle Book,,"Emma Tate, Jimmy Hibbert, Sam Gold, David Holt, Joseph J. Terry","India, Germany, France","May 11, 2019",2010,TV-Y7,1 Season,Kids' TV,"This animated series follows young Mowgli and his animal mentors Bagheera and Baloo, who do their best to protect him from fierce tiger Shere Khan."
251,70261058,Movie,Aiyyaa,Sachin Kundalkar,"Rani Mukerji, Prithviraj Sukumaran, Nirmiti Sawant, Subodh Bhave, Jyoti Subhash, Satish Alekar, Anita Date, Amey Wagh, Kishori Balal, Pakoda Pandi",India,"May 10, 2017",2012,TV-14,151 min,"Comedies, International Movies, Music & Musicals","An outspoken, imaginative girl from a conservative family pursues her dream man while fending off the prospect of an arranged marriage."
252,70204288,Movie,Bbuddah Hoga Terra Baap,Puri Jagannadh,"Amitabh Bachchan, Hema Malini, Raveena Tandon, Sonu Sood, Sonal Chauhan, Charmy Kaur, Prakash Raj, Makrand Deshpande, Subbaraju, Shawar Ali, Rajeev Verma",India,"May 10, 2017",2011,TV-14,116 min,"Action & Adventure, Comedies, Dramas","A cooly confident aging hit man returns from exile in Paris to his old city, Mumbai, to revisit his past and perform one last job."
253,80057278,Movie,Gabbar Is Back,Krish,"Akshay Kumar, Shruti Haasan, Sunil Grover, Kareena Kapoor, Ishita Vyas, Suman Talwar, Jaideep Ahlawat, Shruti Bapna",India,"May 10, 2017",2015,TV-14,128 min,"Action & Adventure, Dramas, International Movies","After a vengeful college professor targets corruption in the government, he adopts the name ""Gabbar"" and becomes a hero to a weary public."
254,70293703,Movie,Madras Café,Shoojit Sircar,"John Abraham, Nargis Fakhri, Rashi Khanna, Avijit Dutt, Prakash Belawadi, Ajay Ratnam, Siddartha Basu, Agnello Dias, Dibang",India,"May 10, 2017",2013,NR,128 min,"Dramas, International Movies, Thrillers",An Indian intelligence agent journeys to a war-torn coastal island to break a resolute rebel group and meets a passionate journalist.
255,80165853,Movie,Michael,Ribhu Dasgupta,"Naseeruddin Shah, Mahie Gill, Sabyasachi Chakrabarty, Rudranil Ghosh, Iravati Harshe, Churni Ganguly, June Maliah, Purav Bhandare, Shridhar Watsar",India,"May 10, 2017",2011,TV-MA,86 min,"Dramas, Independent Movies, International Movies","After a dedicated cop accidentally kills a 12-year-old boy, he's fired, harassed and forced to take menial work as he tries to keep his life together."
256,81094083,Movie,Kia and Cosmos,Sudipto Roy,"Ritwika Pal, Swastika Mukherjee, Joy Sengupta",India,"May 1, 2019",2018,TV-14,124 min,"Dramas, Independent Movies, International Movies",A 15-year-old girl with autism attempts to write a mystery novel based on her hunt for the killer of a neighborhood cat.
257,81093342,Movie,Sur Sapata,Mangesh Kanthale,"Upendra Limaye, Govind Namdeo, Sanjay Jadhav, Anand Ingale, Bharat Ganeshpure, Praveen Tarde, Chinmay Patwardhan, Jivan Karlakar",India,"May 1, 2019",2019,TV-14,140 min,"Comedies, Dramas, International Movies",A group of small-town students goes for glory by competing in a statewide kabaddi tournament 25 years after their school's championship victory.
258,80150390,Movie,Abhinetri,A. L. Vijay,"Tamannaah Bhatia, Prabhu Deva, Sonu Sood, Sapthagiri, Murli Sharma, R.V. Udhaykumar, Joy Mathew, Hema",India,"May 1, 2018",2016,TV-14,131 min,"Comedies, International Movies, Sci-Fi & Fantasy","Due to family pressure, a corporate man reluctantly marries a woman from the village, but in their new home, she abruptly assumes a different persona."
259,80993495,Movie,Ajji,Devashish Makhija,"Sushama Deshpande, Abhishek Banerjee, Smita Tambe, Sharvani Suryavanshi, Vikas Kumar, Sadiya Siddiqui, Sudhir Pandey, Manuj Sharma",India,"May 1, 2018",2017,TV-MA,105 min,"Dramas, International Movies","When her small granddaughter is sexually assaulted by a powerful man and no justice is served, a poor, frail old woman plots her violent revenge."
