index,show_id,type,title,director,cast,country,date_added,release_year,rating,duration,listed_in,description
391,70001564,Movie,Yuva,Mani Ratnam,"Ajay Devgn, Abhishek Bachchan, Vivek Oberoi, Esha Deol, Kareena Kapoor, Rani Mukerji, Loveleen Mishra, Anant Nag, Om Puri, Vijay Raaz, Sonu Sood",India,"March 1, 2018",2004,TV-MA,160 min,"Dramas, International Movies","An accident on a bridge ties together three young men from different social classes, sparking a course of events that will forever alter their lives."
392,80165917,Movie,Nila,Selvamani Selvaraj,"Sruthi Hariharan, Vicky R",India,"March 1, 2017",2016,NR,94 min,"Dramas, International Movies, Romantic Movies","When a cabbie chances upon his childhood sweetheart, he tries to rekindle old feelings but finds that mature love is a more complicated matter."
393,70155788,Movie,Revelations,Vijay Jayapal,"Chetan, Lakshmi Priyaa Chandramouli, Anantharam Karthik, Arpita Banerjee",India,"March 1, 2017",2016,NR,118 min,"Dramas, International Movies","After four years together, a husband and wife become entangled in secret, sexually charged relationships that threaten to unravel their marriage."
394,70285730,Movie,Ugly,Anurag Kashyap,"Rahul Bhat, Ronit Roy, Tejaswini Kolhapure, Vineet Kumar Singh, Surveen Chawla, Siddhant Kapoor, Girish Kulkarni, Abir Goswami, Madhavi Singh, Anshikaa Shrivastava, Murari Kumar, Sandesh Jadhav",India,"March 1, 2017",2013,NR,125 min,"Dramas, International Movies, Thrillers","When a 10-year-old goes missing while her father, an actor, is out on an audition, the girl's stepfather – Mumbai's police chief – leads the search."
395,81113918,Movie,Luka Chuppi,Laxman Utekar,"Kartik Aaryan, Kriti Sanon, Pankaj Tripathi, Vinay Pathak, Aparshakti Khurana, Atul Srivastava, Alka Amin",India,"June 7, 2019",2019,TV-14,125 min,"Comedies, International Movies, Romantic Movies","Pretending to marry in order to cohabitate, a small-town couple lands in endless awkward situations to hide the truth from their orthodox families."
396,81113921,Movie,Stree,Amar Kaushik,"Rajkummar Rao, Shraddha Kapoor, Pankaj Tripathi, Aparshakti Khurana, Abhishek Banerjee, Atul Srivastava",India,"June 7, 2019",2018,TV-MA,127 min,"Comedies, Horror Movies, Independent Movies","Once a year, men in a small town fear abduction by an eccentric female spirit. A young tailor dismisses the idea of the ghost – until he falls for her."
397,70290904,Movie,B.A. Pass,Ajay Bahl,"Shadab Kamal, Shilpa Shukla, Rajesh Sharma, Dibyendu Bhattacharya, Vijay Kaushik, Anula Navlekar, Happy Ranjit, Raveena Singh, Padam Mishra",India,"June 7, 2018",2013,NR,99 min,"Dramas, Independent Movies, International Movies","Orphaned and at loose ends, young Mukesh falls into the seductive orbit of married Sarika, who leads him ever deeper into a world of sex and betrayal."
398,80169554,Movie,The Wishing Tree,Manika Sharma,"Shabana Azmi, Makrand Deshpande, Harshpreet Kaur, Aabhas Yadav, Shivani Joshi, Saurabh Shukla",India,"June 5, 2017",2017,TV-14,117 min,"Children & Family Movies, Dramas, Music & Musicals",Five children living on the edge of a forest band together to save a magical wishing tree from destruction and find their own paths to happiness.
399,81039384,Movie,Romeo Akbar Walter,Robbie Grewal,"John Abraham, Jackie Shroff, Mouni Roy, Sikander Kher, Raghuvir Yadav, Alka Amin, Rajesh Shringarpure, Anil George",India,"June 30, 2019",2019,TV-14,141 min,"Dramas, International Movies, Thrillers","In 1971, a fallen army major’s son is tapped by India's Research and Analysis Wing to serve as an undercover agent in Pakistan in the lead-up to war."
400,81128584,Movie,Super Deluxe,Thiagarajan Kumararaja,"Vijay Sethupathi, Fahadh Faasil, Samantha Ruth Prabhu, Ramya Krishnan, Mysskin, Gayathrie, Ashwanth Ashok Kumar, Bagavathi Perumal",India,"June 29, 2019",2019,TV-MA,176 min,"Comedies, Dramas, International Movies","Sex, stigma and spirituality merge in these eccentric stories of an angsty teenager, an unfaithful wife and a transgender woman returning to her past."
401,70236020,Movie,Kahaani,Sujoy Ghosh,"Vidya Balan, Parambrata Chatterjee, Dhritiman Chatterjee, Saswata Chatterjee, Indraneil Sengupta, Nawazuddin Siddiqui, Darshan Jariwala, Masood Akhtar, Riddhi Sen",India,"June 26, 2019",2012,TV-14,122 min,"International Movies, Music & Musicals, Thrillers","Pregnant and alone in the city of Kolkata, a woman begins a relentless search for her missing husband, only to find that nothing is what it seems."
402,81108230,Movie,Unbroken,Svati Chakravarty Bhatkal,,India,"June 26, 2019",2019,TV-14,109 min,"Documentaries, International Movies","After the brutal murders of their loved ones, three individuals share how they healed through forgiveness in this documentary presented by Aamir Khan."
403,81095399,Movie,Tottaa Pataaka Item Maal,Aditya Kripalani,"Shalini Vatsa, Chitrangada Chakraborty, Vinay Sharma, Sonal Joshi, Kritika Pande",India,"June 25, 2019",2018,TV-MA,107 min,"Dramas, Independent Movies, International Movies","Exasperated with living in perpetual fear for their safety, four women kidnap a man to show him the realities of being female in Delhi."
404,80171598,Movie,Kaabil,Sanjay Gupta,"Hrithik Roshan, Yami Gautam, Ronit Roy, Rohit Roy, Narendra Jha, Girish Kulkarni, Sahidur Rahaman, Suresh Menon",India,"June 25, 2017",2017,TV-PG,139 min,"Dramas, International Movies","The happy life of a young blind couple is shattered when the wife is raped and corrupt police won't help, sending the husband on a quest for revenge."
405,80166185,Movie,Dangal,Nitesh Tiwari,"Aamir Khan, Sakshi Tanwar, Fatima Sana Shaikh, Sanya Malhotra, Aparshakti Khurana, Zaira Wasim, Suhani Bhatnagar, Ritwik Sahore",India,"June 21, 2017",2016,TV-PG,161 min,"Dramas, International Movies, Sports Movies",A once-promising wrestler pursues the gold medal he never won by training two of his daughters to compete at the Commonwealth Games.
406,81131274,Movie,Rakkhosh,"Abhijit Kokate, Srivinay Salian","Sanjay Mishra, Priyanka Bose, Tannishtha Chatterjee, Barun Chanda, Sonamoni Jayant Gadekar, Ashwath Bhatt, Atul Mahale",India,"June 20, 2019",2019,TV-MA,116 min,"Horror Movies, Independent Movies, International Movies",An asylum patient’s troubled past threatens his grasp on reality as fellow hospital residents begin disappearing at the hands of an unknown entity.
407,81110386,Movie,Krutant,Datta Mohan Bhandare,"Suyog Rajendra Gorhe, Sandeep Kulkarni, Vidya Karanjikar, Sayli Patil",India,"June 2, 2019",2019,TV-14,114 min,"Dramas, International Movies","When a busy workaholic leaves town to meet friends, an unexpected delay leads him to the hut of an old man, whose haunting tale could change his life."
408,81123052,Movie,Luckee,Sanjay Jadhav,"Abhay Mahajan, Dipti Sati, Mayur More, Shubhangi Tambale, Chetan Dalvi, Nilesh Diwekar",India,"June 15, 2019",2019,TV-14,113 min,"Comedies, International Movies, Romantic Movies","When his friends make a bet that he can woo his college crush, a lovesick student named Luckee struggles between satisfying his heart and hormones."
409,81113927,Movie,Pihu,Vinod Kapri,Pihu Myra Vishwakarma,India,"June 15, 2019",2018,TV-14,90 min,"Dramas, Independent Movies, International Movies","A two-year-old must fend for herself when her mother suddenly passes away while her father is gone for a conference, leaving her prone to danger."
410,80991033,Movie,Lust Stories,"Zoya Akhtar, Karan Johar, Anurag Kashyap, Dibakar Banerjee","Vicky Kaushal, Bhumi Pednekar, Radhika Apte, Neha Dhupia, Manisha Koirala, Akash Thosar, Randeep Jha, Neil Bhoopalam, Jaideep Ahlawat, Sanjay Kapoor, Kiara Advani",India,"June 15, 2018",2018,TV-MA,121 min,"Comedies, Dramas, International Movies","In the companion to 2013's ""Bombay Talkies,"" four short films by four of India's biggest directors explore love, sex and relationships in modern India."
411,80187684,Movie,Kanavu Variyam,Arun Chidambaram,"Jiya Anil Manne, Arun Chidambaram, T.P. Gajendran, Gnanasambandam, M. Ilavarasu, Yog Japee, Mayilsamy, Black Pandi",India,"June 15, 2017",2017,TV-PG,104 min,"Comedies, Dramas, International Movies","Despite doubts from fellow villagers who think he’s crazy, an ambitious dropout commits himself to solving a persistent local electricity crisis."
412,80222951,TV Show,Leila,,"Huma Qureshi, Siddharth, Rahul Khanna, Arif Zakaria, Seema Biswas, Sanjay Suri, Akash Khurana, Ashwath Bhatt, Anupam Bhattacharya, Adarsh Gourav",India,"June 14, 2019",2019,TV-MA,1 Season,"International TV Shows, TV Dramas, TV Mysteries","In a near-future world where an oppressive regime segregates society, one woman skirts the system to search for the daughter taken from her years ago."
413,81062606,Movie,III Smoking Barrels,Sanjib Dey,"Subrat Dutta, Indraneil Sengupta, Mandakini Goswami, Amrita Chattopadhyay, Nalneesh Neel, Niloy Sankar Gupta, Shiny Gogoi, Siddharth Boro",India,"June 1, 2019",2017,TV-MA,128 min,"Dramas, Independent Movies, International Movies","In three stories set in Northeast India, a child goes on the run, a young adult falls in with the wrong crowd and a desperate man turns to crime."
414,80994443,Movie,B.A. Pass 2,Shadab Khan,"Kritika Sachdeva, Sasho, Sanghmitra Hitaishi, Indraneil Sengupta, Saurabh Dubey, Shubhangi Latkar, Sukhbir Kaur Lamba, Arav Chowdharry",India,"June 1, 2018",2017,TV-14,126 min,"Dramas, International Movies","A young woman eager to avoid an arranged marriage moves to Mumbai, where she learns hard truths about show business, life and love."
415,80229216,TV Show,Gabru: Hip Hop Revolution,,"Amol Parashar, Harleen Sethi, Chaitanya Sharma, Priya Malik, Pratik Dixit",India,"June 1, 2018",2018,TV-14,1 Season,"International TV Shows, TV Dramas","Three young, aspiring Indian rappers make their way in a cutthroat music industry, dreaming of fame, stardom and ultimate hip-hop domination ."
416,80998558,Movie,Natsamrat - Asa Nat Hone Nahi,Mahesh Manjrekar,"Nana Patekar, Medha Manjrekar, Mrinmayee Deshpande, Sunil Barve, Vikram Gokhale, Neha Pendse",India,"June 1, 2018",2016,TV-14,165 min,"Dramas, International Movies","A veteran Shakespearean actor steps off the stage and into the painful tragedy of old age, facing ungrateful family and his fleeting legacy."
417,80157084,Movie,Aashik Awara,Umesh Mehra,"Saif Ali Khan, Mamta Kulkarni, Mohnish Bahl, Sharmila Tagore, Saeed Jaffrey, Kader Khan",India,"June 1, 2017",1993,TV-14,154 min,"Dramas, International Movies, Music & Musicals","Raised by a kindly thief, orphaned Jimmy goes on the run from goons and falls in love with Jyoti, whose father indirectly caused his parents' deaths."
418,80122189,TV Show,Fear Files... Har Mod Pe Darr,,,India,"June 1, 2017",2015,TV-MA,1 Season,"International TV Shows, TV Horror, TV Thrillers","Possessed lovers, witches, haunted houses and more bring tales of horror to the screen in this anthology series."
419,80121872,TV Show,Jhansi Ki Rani,,"Ulka Gupta, Sameer Dharmadhikari, Amit Pachori, Shailesh Dattar, Aruna Irani",India,"June 1, 2017",2009,TV-14,1 Season,"International TV Shows, TV Dramas","In British-ruled, 19th-century India, a 14-year-old girl trains as a warrior and becomes a devoted crusader in her country's fight for independence."
420,80158920,Movie,Lens,Jayaprakash Radhakrishnan,"Jayaprakash Radhakrishnan, Anand Sami, Aswathy Lal, Misha Ghoshal",India,"June 1, 2017",2015,TV-MA,109 min,"Dramas, Independent Movies, International Movies","Addicted to webcams and voyeurism, a married man gets more than he bargained for when an online stranger tries to force him to watch a suicide."
421,70057994,Movie,Maya Memsaab,Ketan Mehta,"Deepa Sahi, Farooq Shaikh, Raj Babbar, Shah Rukh Khan, Shreeram Lagoo, Sudha Shivpuri, Paresh Rawal, Raghuvir Yadav, Satyadev Dubey","France, United Kingdom, India","June 1, 2017",1993,NR,122 min,"Dramas, International Movies, Music & Musicals","A beautiful, wealthy woman’s insatiable appetite for romance leads to tragedy and a police investigation."
422,80156937,Movie,Oh Darling Yeh Hai India,Ketan Mehta,"Shah Rukh Khan, Deepa Sahi, Javed Jaffrey, Anupam Kher, Amrish Puri, Tom Alter, Tinnu Anand, Sadashiv Amrapurkar, Tiku Talsania, Kader Khan",India,"June 1, 2017",1995,TV-14,154 min,"Action & Adventure, Comedies, International Movies",A penniless actor new to Mumbai and a beautiful woman he meets one fateful night try to stop a gangster from replacing India's president with a twin.
423,80158546,Movie,Prince,Lekh Tandon,"Shammi Kapoor, Vyjayantimala, Rajendra Nath, Ajit, Helen, Leela Chitnis, Parveen Choudhary, Sudhir, Sunder, Rashid Khan",India,"June 1, 2017",1969,TV-14,152 min,"Dramas, International Movies, Romantic Movies","To better himself, a spoiled prince temporarily assumes a commoner’s identity. But he soon learns his palace has been gifted to his father’s new wife."
424,80156936,Movie,Qila,Umesh Mehra,"Dilip Kumar, Mukul Dev, Rekha, Mamta Kulkarni, Smita Jaykar, Gulshan Grover",India,"June 1, 2017",1998,TV-14,161 min,"Dramas, International Movies","When an abusive landowner is murdered, his twin brother sets out to find the killer but quickly discovers that everyone, it seems, wanted him dead."
425,80122238,TV Show,The Golden Years with Javed Akhtar,,,India,"June 1, 2017",2016,TV-G,1 Season,"Docuseries, International TV Shows","Writer, poet and lyricist Javed Akhtar hosts this musical trip down memory lane, revealing untold stories behind India's best songs of 1950-75."
426,80177339,Movie,Motu Patlu: King of Kings,Suhas Kadav,"Saurav Chakrabarty, Vinay Pathak",India,"July 6, 2017",2016,TV-Y7-FV,109 min,"Children & Family Movies, Comedies","Motu and Patlu want to help a circus lion get back to the jungle. On the way, the three become caught up in an exciting adventure in the forest."
427,80097355,Movie,Brahman Naman,Qaushiq Mukherjee,"Shashank Arora, Tanmay Dhanania, Chaitanya Varad, Vaishwath Shankar, Sindhu Sreenivasa Murthy, Sid Mallya, Denzil Smith","India, United Kingdom","July 6, 2016",2016,TV-MA,96 min,"Comedies, Independent Movies, International Movies",This homage to 1980s teen sex comedies follows a college quiz bowl champion who knows almost everything – except how to talk to women.
428,80102266,TV Show,Dharmakshetra,,"Kashmira Irani, Chandan Anand, Dinesh Mehta, Ankit Arora, Pushkar Goggiaa, Anjali Rana, Aarya DharmChand Kumar, Amit Behl, Maleeka Ghai",India,"July 5, 2018",2014,TV-14,1 Season,"International TV Shows, TV Dramas, TV Sci-Fi & Fantasy","After the ancient Great War, the god Chitragupta oversees a trial to determine who were the battle's true heroes and villains."
429,80102162,TV Show,Raja Rasoi Aur Anya Kahaniyan,,,India,"July 5, 2018",2014,TV-G,1 Season,"Docuseries, International TV Shows","Explore the history and flavors of regional Indian cuisine, from traditional Kashmiri feasts to the vegetarian dishes of Gujarat."
430,80102160,TV Show,Stories by Rabindranath Tagore,Anurag Basu,,India,"July 5, 2018",2015,TV-14,1 Season,"International TV Shows, TV Dramas",The writings of Nobel Prize winner Rabindranath Tagore come to life in this collection of tales set in early-20th-century Bengal.
431,81151899,TV Show,7 (Seven),Nizar Shafi,"Rahman, Havish, Regina Cassandra, Nandita Swetha, Anisha Ambrose, Tridha Choudhury, Pujitha Ponnada, Aditi Arya",India,"July 30, 2019",2019,TV-14,1 Season,TV Shows,"Multiple women report their husbands as missing but when it appears they are looking for the same man, a police officer traces their cryptic connection."
432,81005453,Movie,Parmanu: The Story of Pokhran,Abhishek Sharma,"John Abraham, Boman Irani, Diana Penty, Anuja Sathe, Yogendra Tikku, Aditya Hitkari, Vikas Kumar, Ajay Shankar, Darshan Pandya, Mark Benington",India,"July 25, 2018",2018,TV-14,124 min,"Dramas, International Movies","A dedicated government official puts his career in jeopardy by insisting that India become a nuclear power, a goal that powerful forces resist."
433,81006594,Movie,Waterschool,Tiffanie Hsu,,"United States, Brazil, India, Uganda, China","July 25, 2018",2018,PG,68 min,Documentaries,"Six young women, who each live near one of Earth's major rivers, share how the Waterschool environmental education program has impacted their lives."
434,70034607,Movie,Bewafaa,Dharmesh Darshan,"Anil Kapoor, Akshay Kumar, Kareena Kapoor, Sushmita Sen, Shamita Shetty, Manoj Bajpayee, Kabir Bedi, Nafisa Ali, Supriya Pathak, Raj Premi, Supriya Karnik",India,"July 21, 2019",2005,TV-PG,149 min,"Dramas, International Movies, Romantic Movies","A young woman faces pressure to marry her brother-in-law, after her sister dies while giving birth. But she's secretly in love with someone else."
435,80996338,TV Show,Typewriter,,"Aarna Sharma, Aaryansh Malviya, Mikail Gandhi, Palash Kamble, Jishu Sengupta, Palomi Ghosh, Purab Kohli, Sameer Kochhar, Sara Gesawat",India,"July 19, 2019",2019,TV-MA,1 Season,"International TV Shows, TV Horror, TV Mysteries","Three young friends in Goa plan to search an old villa for ghosts, but when a new family moves in, the home’s buried past resurfaces in chilling ways."
436,80183329,Movie,Aditi Mittal: Things They Wouldn't Let Me Say,Fazila Allana,Aditi Mittal,India,"July 18, 2017",2017,TV-MA,63 min,Stand-Up Comedy,"Trailblazing comic Aditi Mittal mixes topical stand-up with frank talk about being single, wearing thongs and the awkwardness of Indian movie ratings."
437,81113926,Movie,Mauli,Aditya Sarpotdar,"Riteish Deshmukh, Saiyami Kher, Jitendra Joshi, Siddarth Jadhav, Shrikant Yadav, Vijay Nikam, Umesh Jagtap, Usha Naik, Girija Oak, Genelia D'Souza",India,"July 17, 2019",2018,TV-14,136 min,"Action & Adventure, Dramas, International Movies",An unconventional police officer faces off against a gang of thugs as he tries to bring order to the far-flung village he’s been stationed in.
438,81155782,Movie,Bogda,Nisheeta Keni,"Suhas Joshi, Mrunmayee Deshpande, Rohit Kokate, Ajinkya Bhosale, Jayant Gadekar, Vivekanand Walake, Pallavi Malvade, Nirmala Tikam",India,"July 16, 2019",2018,TV-PG,161 min,"Dramas, International Movies",An aspiring dancer accompanies her terminally ill mother on one last road trip that alternately strains and strengthens their knotty relationship.
439,70171835,Movie,Tahaan,Santosh Sivan,"Purav Bhandare, Anupam Kher, Rahul Bose, Victor Banerjee, Ankush Dubey, Rasika Dugal, Rahul Khanna, Sana Shaikh, Dheirya Sonecha, Fatima Sana Shaikh, Sarika",India,"July 15, 2018",2008,TV-14,95 min,"Dramas, International Movies","After his family's donkey is confiscated by a moneylender, 8-year-old Tahaan travels across conflict-torn Kashmir to find his beloved pet."
440,70298393,Movie,Singh Saab the Great,Anil Sharma,"Sunny Deol, Urvashi Rautela, Prakash Raj, Amrita Rao, Anjali Abrol, Johnny Lever, Sanjay Mishra, Yashpal Sharma, Manoj Pahwa, Raj Premi",India,"July 15, 2017",2013,TV-14,143 min,"Action & Adventure, Dramas, International Movies","As the result of a TV journalist's curiosity, the amazing saga of an honorable government tax collector's past comes to light."
441,80191557,Movie,Vitti Dandu,Ganesh Kadam,"Dilip Prabhavalkar, Ashok Samarth, Yatin Karyekar, Nishant Bhavsar, Mrunal Thakur, Vikas Kadam, Utpal Sawant, Ravindra Mankani, Shubhankar Atre, Charudatta Bhagwat",India,"July 15, 2017",2014,TV-14,116 min,"Dramas, International Movies","In a remote village in colonial India, an old man and his grandson display strong differences in their attitudes toward the country's British rulers."
442,81088331,TV Show,Chhota Bheem,,"Vatsal Dubey, Julie Tejwani, Rupa Bhimani, Jigna Bhardwaj, Rajesh Kava, Mousam, Swapnil",India,"July 11, 2019",2019,TV-Y7,1 Season,Kids' TV,"A brave, energetic little boy with superhuman powers leads his friends on exciting adventures to guard their fellow Dholakpur villagers from evil."
443,80182447,Movie,Angamaly Diaries,Lijo Jose Pellissery,"Antony Varghese, Sarath Kumar, Tito Wilson, Reshma Rajan, Vineeth Vishwam, Kichu Tellus, Bitto Davis, Ullas Jose Chemban, Merin Jose Pottackal, Binny Rinky Benjamin, Amrutha Anna Reji",India,"July 1, 2018",2017,TV-14,128 min,"Action & Adventure, Comedies, Dramas","After growing up amidst the gang wars of his hometown, Vincent forms an entrepreneurial squad of his own and ends up on the wrong side of the law."
444,70055855,Movie,Anthony Kaun Hai?,Raj Kaushal,"Sanjay Dutt, Arshad Warsi, Minissha Lamba, Raghuvir Yadav, Anusha Dhandekar, Gulshan Grover, Ravi Baswani",India,"July 1, 2018",2006,TV-14,122 min,"Comedies, Dramas, International Movies","A forger uses a fake identity in trying to retrieve stolen diamonds buried in a penitentiary, unaware a mob assassin is on the trail of his phony alias."
445,80994575,Movie,Cappuccino,Noushad,"Dharmajan Bolgatty, Aneesh Menon, Sunil Sukhada, Anita Lukmance, Kottayam Pradeep, Natasha Doshi, Hareesh Perumanna, Sharanya, Vineeth Mohan, Sudhi Koppa",India,"July 1, 2018",2017,TV-14,126 min,"Comedies, Dramas, International Movies","Richi is a director of commercials whose computer memory drive is accidentally switched with that of Sneha, a woman he soon falls in love with."
446,60036112,Movie,Chalte Chalte,Aziz Mirza,"Shah Rukh Khan, Rani Mukerji, Jas Arora, Satish Shah, Rajiv Verma, Lillete Dubey, Jayshree T., Johny Lever",India,"July 1, 2018",2003,TV-PG,166 min,"Dramas, International Movies, Romantic Movies","Priya and Raj are polar opposites. Raj is brash and earthy, while Pirya is sophisticated and something of a perfectionist in all she does. They really are like oil and water, but nonetheless, they dare to fall in love."
447,80994424,Movie,Chicken Kokkachi,Anuranjan Premji,"Anuranjan Premji, Indrans, Dharmajan Bolgatty, Sudhi Koppa, Bijukuttan, Neha Rathanakaran, Prasanth",India,"July 1, 2018",2017,TV-14,113 min,"Comedies, International Movies","In the wake of his sister's marriage, a young middle-class man leaves his village and learns that supporting one's self is easier said than done."
448,80994423,Movie,Daffedar,Johnson Esthappan,"Tini Tom, Malavikka, Sudheer Karamana, Indrans",India,"July 1, 2018",2017,TV-PG,151 min,"Dramas, International Movies","A retired government worker continues to dedicate himself to public service, but his principled ways soon clash with those of his extravagant sons."
449,80236278,Movie,Deewana Main Deewana,K.C. Bokadia,"Govinda, Priyanka Chopra, Kader Khan, Prem Chopra, Shakti Kapoor, Sharat Saxena, Himani Shivpuri, Johnny Lever",India,"July 1, 2018",2013,TV-14,107 min,"Comedies, Dramas, International Movies",A man's instant attraction to a woman becomes an obsession as he adopts a friend's identity and even commits murder in order to get closer to her.
450,80180851,Movie,Gemini,P.K. Baaburaaj,"Esther Anil, Sijoy Varghese, Renji Panicker, Thanusree Ghosh, Sasi Kalinga, Kishore Sathya, Sethu Lakshmi, Rosin Jolly",India,"July 1, 2018",2018,TV-PG,130 min,Dramas,"Despite growing up with traits that set her apart from her peers, a young adopted girl discovers her gift when she takes an interest in spelling bees."
451,80236279,Movie,I Am Kalam,Nila Madhab Panda,"Gulshan Grover, Harsh Mayar, Pitobash, Hussan Saad, Beatrice Ordeix, Sanjay Chauhan",India,"July 1, 2018",2010,TV-PG,87 min,"Children & Family Movies, Comedies, Dramas",An intelligent boy born into poverty befriends the son of a once noble family and is inspired by the life of India's president to pursue an education.
452,80994573,Movie,Kaviyude Osyath,Vineeth Anil,"Prakash Bare, Arun Kumar, Kulappulli Leela, Sangeetha Mohan, Kochu Preman",India,"July 1, 2018",2017,TV-PG,116 min,"Dramas, International Movies","When a late poet leaves behind his property to a young man, the man's brother suspects the poet may have been more than just a family friend."
453,80994425,Movie,Ma Chu Ka,Jayan Vannery,"Pasupathy, Janani Iyer, Pratap Pothen",India,"July 1, 2018",2017,TV-14,117 min,"International Movies, Thrillers",The relationship between a journalist and a lawyer she meets while investigating a story grows complicated as she uncovers layers of deception.
454,81002211,Movie,My Birthday Song,Samir Soni,"Sanjay Suri, Nora Fatehi, Zenia Starr, Suparna Krishna, Elena Kazan",India,"July 1, 2018",2018,TV-14,92 min,"Dramas, International Movies, Thrillers","After a wild night of impulse and infidelity, advertising executive Rajiv Kaul must navigate the blurred lines between life, death, fact and fiction."
455,70062158,Movie,Namastey London,Vipul Amrutlal Shah,"Akshay Kumar, Katrina Kaif, Rishi Kapoor, Upen Patel, Javed Sheikh, Nina Wadia, Clive Standen, Tiffany Mulheron",India,"July 1, 2018",2007,TV-PG,130 min,"Dramas, International Movies, Romantic Movies","To her Indian parents' dismay, London-born Jasmeet ""Jazz"" Malhotra longs for everything Western, including her British boyfriend. On a family trip to India, her father arranges Jazz's nuptials to Arjun Ballu Singh, who's smitten with his new bride."
456,80994419,Movie,Paathi,Chandran Narikode,"Indrans, Joy Mathew, Kalabhavan Shajohn, Sasi Kalinga, Santhosh Keezhattoor, Valsala Menon, Seema G. Nair, Parvathi T",India,"July 1, 2018",2017,TV-MA,89 min,"Dramas, International Movies",A face painter for Theyyam rituals who is himself disfigured conceals his guilt over the fact that he performs abortions as a medical practitioner.
457,80994426,Movie,Pareeth Pandaari,Gafoor Y. Elliyaas,"Kalabhavan Shajohn, Sajitha Madathil, Jaffer Idukki, Sunil Sukhada, Joy Mathew, Ansiba",India,"July 1, 2018",2017,TV-PG,109 min,"Dramas, Independent Movies, International Movies","As the parents of three unmarried daughters, a humble cook and his wife contend with the challenges of matchmaking and social expectations."
458,80994574,Movie,Paulettante Veedu,Dileep Narayanan,"Saikumar, Amal Unnithan, Manasa Radhakrishnan, K.P.A.C. Lalitha, Sudheer Karamana, Seema G. Nair",India,"July 1, 2018",2016,TV-14,104 min,"Dramas, International Movies","A wealthy businessman's miserly habits cause no small amount of stress and embarrassment to his family, particularly his daughter."
